,Content,Location,Username,Retweet-Count,Favorites,Created at
998,"$SPY at 8,000 by 2030 

The stock market could double by 2030 because COVID has 'utterly changed' the policy environment: analyst https://t.co/0s08fgBp8V",,MadmastH,0,0,2021-03-30 19:59:08
999,"Practice Spanish in a relaxed environment to improve your proficiency. #UCF Spanish students of all levels are welcome to join us to practice the language, &amp; be exposed to different varieties of Spanish.
Thursday, April 1, 4:30-5:30pm
Email @UCFSaGA at SaGA@ucf.edu for Zoom link https://t.co/XsySz5mEio",University of Central Florida,UCF_ModernLang,0,0,2021-03-30 19:59:03
1000,@Cante12175815 @RyannMcEnany @FoxNews @OutnumberedFNC @kayleighmcenany There's also a huge difference in how the press treats Jen Psaki &amp; Biden administration vs. how hostile they were with the Trump administration. Kayleigh McEnany was in an extremely hostile environment (the press doesn't try to hide it anymore) and always came out looking great.,"FEMA Region 5, USA",GovernAmerica,0,1,2021-03-30 19:58:58
1001,Its been 4 days and yall are still going..... how can you be the first people to say that this app is a toxic environment for everyone yet you're out here fighting for a whole week my goood 😭😭😭😭,ukraine,gngwonder,0,13,2021-03-30 19:58:58
1002,Gangreene just can't prevent herself from walking in shit. It's her natural environment.  I figured out long ago there she had a lump of mucus where most people have a functioning.  #ExpelGreene https://t.co/KZe2T66L5P,"Mcallen,Texas",STXparanormal,0,0,2021-03-30 19:58:58
1003,@LachlanBruce We all need to do more. https://t.co/MLzBF9Cj6O,Scotland,SunScot,0,0,2021-03-30 19:58:56
1004,@cybersecmeg Biggest consideration I don't see yet: determining when the ransomware entered the environment before you restore from your backups. Test restore in an isolated environment and scan for IOCs if you can't tell.,,NCC800_53A,0,2,2021-03-30 19:58:51
1005,@auroraluvbot it’s not SMUT WTF it’s just not the right environment 😭😭😭,she|her ,KimLipaige,0,0,2021-03-30 19:58:50
1006,So tired of my toxic work environment,,arissara_sw,0,1,2021-03-30 19:58:49
1007,@LesorLel @petemorristwit @Pit_Dxb @MarcherLord1 Will survive the physical environment much better than mechanical components. But the way these things are designed means extra cost to replace and wastage in perfectly good components being replaced unnecessarily.,Uk,deserter1900,0,0,2021-03-30 19:58:48
1008,"@Tricky_Eileen @LBOtv Tricky... lol haven't worked in an office environment? 
 NOT that it's exactly an enjoyable environment or anything but yeah OOO is common jargon","San Diego, CA",Shinkuhadoken88,0,1,2021-03-30 19:58:42
1009,"I'm running out of hours in the day for good Wildlife, Environment and Sustainability Podcasts but here is another. Check out @IntoTheWildPod by @MrRyanJDalton https://t.co/pN3AvDZCYR",Kent,DowlingWildlife,2,4,2021-03-30 19:58:40
1010,"Protection, Freedom &amp; Justice as they live in a Spotless Environment Forever like they so rightfully deserve!  Get Out &amp; Stay Out! https://t.co/NWkvE31gMw",,gallinafiedler1,0,0,2021-03-30 19:58:33
1011,"my job is incredibly fulfilling, and a positive social environment. https://t.co/zja1sqP10K","Phidalelphia, PA",Gaydarade,0,18,2021-03-30 19:58:32
1012,"@NayatelOfficial 
@WahajSiraj1 
@ImranKhanPTI
@ICTA_GoP 
@dcislamabad 
@DGMCI
@PTIOfficialISB 
@CDAthecapital 
@naveedtareen99 
@cda_environment 

We need Nayatel at I-10/4.(St 21, St 98) Pls help to clear the issues to provision the facility at I-10/4.",,shahrazaonline,0,0,2021-03-30 19:58:25
1013,@SunriseTrader (March) that was one of the toughest swing environment i ever seen,China,TamirTiko2110,0,4,2021-03-30 19:58:19
1014,"@elonmusk Yo @elonmusk! Howsabout you give me one of those neuralink implants to take my pain away and let me go up in one of those rockets to test its performance in a zero G environment

Applying for a human test subject position","South Texas, USA, Earth",MC_Bruuce,0,0,2021-03-30 19:58:11
1015,"Learning has no age limit, learn from any area or environment you find yourself. https://t.co/eSBfqxkeWK",,mindpower00233,0,0,2021-03-30 19:58:11
1016,"Insights | Best practice in Early Years assessment
Colorful teaching items
Colorful environment 
Reciteful learning
Use of song https://t.co/nYrAE5aITs via @In-Earn",,Gasherrylucy,0,0,2021-03-30 19:58:07
1017,"@chrissieburgess If you just do that mileage, go EV! They are silent, clean, accelerate like sports cars, cost pennies to run, you pay zero road tax, and do your bit for the environment. What’s not to like?",,ficrosbie63,0,0,2021-03-30 19:58:05
1018,"As COVID cases rose and fell in numbers throughout 2020, GSA developed a variety of methods to help the federal, state, and local government agencies manage in this ever-changing environment.

Read more at https://t.co/H1qoD7Cr9r. https://t.co/O9t0XMg3kh","Washington, DC",USGSA,0,0,2021-03-30 19:58:03
1019,"I'm not fit for irl and online environment projects myself into space, and explodes into dust","Looking to game, not for fame",mrayeshen,0,1,2021-03-30 19:58:00
1020,@elonmusk I would love to move to where great opportunities are plentiful.. I fear that if I cannot get my children into an environment with enthusiastic and prod. minds they will go nowhere in life and contribute nothing. I also would like to accomp. some good myself before I die.,Just south of hell,JYartins,0,0,2021-03-30 19:57:49
1021,@KristiNoem @JoeBiden Your irrational phobias block common sense. The passport IS COMMON SENSE and represents an effort to care for others in our environment.,"Earth, last time I checked",LALadyinNC,0,0,2021-03-30 19:57:47
1022,"It’s not about labelling yourself as vegan, vegetarian, plant slant, flexitarian, pegan, paleo, carnivore or keto. It’s about finding ways of eating that are aligned with what your human needs to thrive and that are better for the environment of which you need to thrive in.","London, England",feedthehuman,1,7,2021-03-30 19:57:40
1023,"@kycovid19data Eliminating CAFOs would also increase the number, quality and profitability of family-owned farms. CAFOS are owned by huge corporations with zero regard for the animals, land, health of consumer or environment. Profit is their only consideration.  They also control politicians.","Lake St Louis, MO",Saintsman3,0,0,2021-03-30 19:57:34
1024,"At this time we cannot guarantee a safe environment for our students and staff at this building. For those families who are able, remote learning will take place on Wednesday and Thursday.  Teachers will touch base with students on Wednesday. https://t.co/Sv5ng0z8By","Lowell, MI",lowelldistrict,1,0,2021-03-30 19:57:31
1025,"“Beavers are the creators of life – without beavers there is no life. The other animals are stock cubes, which you put into the stew, spreading richness and flavour to everything,” says Gow

https://t.co/kK52c9s024

#beaver #beaverbeliever #keystonespecies","Maryland, USA",EcotoneInc,1,3,2021-03-30 19:57:28
1026,"Today I wrote what I think was a decent piece of Terraform code. Modules for each application tier, environment isolation and remote state lookup. Going to turn that into blog posts soon. I really makes a difference, and avoids repetition (DRY) :)",Europe,MartinDBA,0,3,2021-03-30 19:57:24
1027,"@_Berrybabyy_ @uppittynegress It doesn't help that to even get a ""real job"" you have to get a college degree (usually only earned by 22-24), sell yourself into debt, and then jump through god-knows-how-many hoops and humiliation rituals. In an environment like that sex work starts to look good.",,AdamasNemesis,0,2,2021-03-30 19:57:23
1028,The stock market could double by 2030 because COVID has ‘utterly changed’ the policy environment: analyst - MarketWatch https://t.co/9RnRTy6Uqn,"Charlotte, NC",snapoutofit2021,0,0,2021-03-30 19:57:22
1029,"Automakers are racing to rebrand themselves for an all-electric future. But they're asking for taxpayers to help foot the bill. Biden will soon signal how his climate plan could deliver jobs, and dollars, to the US auto sector. By @eilperin @StevenMufson https://t.co/jtTDwM5YNs",,alice_crites,0,0,2021-03-30 19:57:15
1030,"""Tranquil Haven""

Decided to try making a more environment-focused render, without a D2 theme, and this is the result! This took quite a long time to make but I am super happy with the result! Definitely some of my best work yet imo!

#blenderart #b3d #art #photoshopart https://t.co/MOfYxurrlO","Göteborg, Sverige",Ohlac3D,12,30,2021-03-30 19:57:14
1031,@scottishgreens The environment knows no borders! You are independence at any price rather than any environmental cause. The SNP Green Brigade are a complete fraud!,London,Alankmacleod,0,0,2021-03-30 19:57:11
1032,* incorrect hyphen usage in this tweet not generally representative of working environment,,EmmaLScotter,0,2,2021-03-30 19:57:11
1033,"Shoutout to @Kairosmith for winning Blizzard’s Student Art Contest in Environment! We went to college together, so I’ve known of his amazing skill at creating conceptual art for years now! Glad to see his prowess officially recognized! (Also glad to see he’s a Venthyr 😉)

~Aaron https://t.co/aMDzQmojpE",Oribos,DoNotRelentPod,0,3,2021-03-30 19:57:10
1034,"I GOT THE JOB!!!
🥰💖💕💖

It's not perfect, and it's going to be hard to transition there, but better environment than I've got right now. Yay! 

Thank you everyone for your well wishes, y'all really help. I love all of you! 💖 https://t.co/QOAvX0pvhd","Pennsylvania, USA",ErinsReallyMia,0,66,2021-03-30 19:56:57
1035,I’m still in max toxicity with 1800’s system of slave and ravaging for honour.... nice...... thx now imagine..... if JT would come to brief and bring sidekick to wit environment minisniff,,JonnieJules,0,0,2021-03-30 19:56:55
1036,"@MaxMelody4 @wasthatthebite @twitone @caraesten 40% of trans folks have attempted suicide, compared to 2% of the general pop. When trans people get access to affirmative care in a supportive environment, their mental health returns to normal.

Transphobia like yours drives people to suicide.",,letsbekind2,0,2,2021-03-30 19:56:49
1037,"The @ScotTories were the first opposition party to publish an environment plan.

The SNP have failed on just about every environment target they’ve set. And the Greens have been there to support their failure all the way.

#BBCLeadersDebate #Leadersdebate","Scotland, United Kingdom",mgoldenmsp,2,7,2021-03-30 19:56:46
1038,"@megamug64 @GarrettTube It has no lighting. All lighting needs to be baked into the materials of the models you import.

Which means, for a realistic environment, you can't really have anything actually MOVE. Without importing a new model, with its shadows/reflections on the surrounding environment.","England, United Kingdom",Popgoes6,0,4,2021-03-30 19:56:45
1039,@RareLtd Please revive this franchise! Game Pass is the perfect environment for it!,UK,JamesCartyBoy88,0,0,2021-03-30 19:56:40
1040,"@NLamolinara @samsherwoodc @WarzoneCheater @ShevrinJones Happiness is determined by your environment, it's not absolute and changes with time. Cave men were ""happy"" living in their caves as they die from now curable illnesses.",,Brittan64277092,0,0,2021-03-30 19:56:38
1041,Protect Nature Challenge - https://t.co/dt8KNtoONu https://t.co/tPJungdPWn,"Guelph, Ontario",BegzadQ,0,1,2021-03-30 19:56:37
1042,cold take i know but jesus christ i hate corporate work culture and faux professionalism. why did we ever create this environment. just be human to each other bro,the amiibo gazebo,picoflare,0,6,2021-03-30 19:56:37
1043,"me: passionate about the environment, lives as eco friendly as i can, doesn't own a car
also me: into one of the most wasteful and detrimental sports to the environment aka formula 1",she/her,tomorrow_mp3,1,1,2021-03-30 19:56:37
1044,"@DailyPostNGR The only thing they could come up with. Is  road cleaner , bush cuter or 50 million youth  to join the military , if you all could see the big picture that, enable environment, security electricity, good road is the road to unemployment problem","Abuja, Nigeria",geoffreydpr,0,0,2021-03-30 19:56:33
1045,"@DJ_Gray6 The going thing in my kid's school is to say ""that's so autistic."" It's creating the most oppressive and terrifying environment for closeted autistic pupils.
And here I was thinking it was 2021.🤔😒",UK ,BeeFlownFar,0,2,2021-03-30 19:56:32
1046,True. This is how whites have been trained to look at us. During apartheid we were the lowest of all races in SA. Now this is how they prioritize. They put us below animals &amp; the environment. Then you get Africans destroying other Africans to please whites. Will Africans unite? https://t.co/hgZnwsrSpD,"Umlazi, South Africa",URfShtvBtsQcJUb,0,0,2021-03-30 19:56:27
1047,@robpitingolo I look forward to the day when carbon capture means my soda addiction helps the environment. har har,"Washington, DC",marctomik,0,0,2021-03-30 19:56:24
1048,Noooo!!!! 🤣Check out this video from #weatherchannel https://t.co/fIhpzab9NL,,MinaMin18091532,0,0,2021-03-30 19:56:24
1049,"@Onthewarpathbuf @ntrider825 @MattKopnak Idk, factoring in age and environment Im not sure Ghost would be any better than a few of the guys already here.",,Highpresshockey,0,0,2021-03-30 19:56:23
1050,And investing in the natural environment,,b_dm_nz,0,0,2021-03-30 19:56:21
1051,"@HMEnvng @DrMuhdMahmood (R) having a tete-a-tete discussion with the PS, @FMEnvng Mr Abel Enitan while the Ag. Registrar @EHORECON_HQ , Dr. Baba Yakubu paid rapt attention to the discussion at the Senate Commitee on Environment Pre-oversight function meeting at National Assembly https://t.co/WO5FCcPbF9",Abuja,EHORECON_HQ,1,2,2021-03-30 19:56:16
1052,"@inspiredrawAW I don't get what the big deal is about the fake digital money of which the mining process is actively harmful to the environment and the currency itself is only traded by a weird internal cult of people saying ""Crypto is cool""

*Stares at camera*",,Dasvidaniya2,0,1,2021-03-30 19:56:15
1053,This study explored the possibility of transferring knowledge and skills from a #SpinalCordInjury unit to the home environment. Understanding transitional difficulties support the re-establishment of a meaningful everyday life. See (open access!) ➡️ https://t.co/xWsmJNL65A https://t.co/VPSp7dxgF3,,JournalSCI,1,0,2021-03-30 19:56:14
1054,"Oh! And I may as well bump it again here for anyone else who's interested ^^ I welcome anyone! New people wanting to get into the game and learn the ropes and all you toxic veterans 😉 

Come join a welcoming friendly gaming environment! 

https://t.co/NtmZ85h50U https://t.co/keAXkMgpmE","England, United Kingdom",RainbowKiri,0,2,2021-03-30 19:56:12
1055,"@UNDP chief @ASteiner says access to finance is vital if the upcoming @COP26 #climate talks are to be a success. The UK has been urged to take the lead in helping poor countries fund climate action. 

Read the article here: https://t.co/WlPcsCDkPk https://t.co/lP3DN9fgGN","Pretoria, South Africa",GWPSAF,0,0,2021-03-30 19:56:05
1056,"@DietBlackPreMed Bill is too busy for this. In a sterile environment like this, AND the hand on Bill’s shoulder? That patient is suing for negligence",GA 🍑 (she/her/ella)🇨🇴🏳️‍🌈,av0gadra,0,1,2021-03-30 19:56:05
1057,"#TarHeels, it's not always easy to find, but if you want to give to a specific Dept on #UNCGive today (ie, Dept. of #UNCGeography, the Dept of Environment &amp; Ecology, Dept of Math, etc) - you can select from the College of Arts and Sciences drop down here: https://t.co/rujgxEWYtp https://t.co/woIL6Zi1aM","Raleigh/Durham/Chapel Hill, NC",MedPipeline,0,0,2021-03-30 19:55:59
1058,@thedragonLML You know how you slowly  acclimatize fish to a tank's temperature before opening the bag and surprising them with a new environment? Well.,PDX,noncorporealfrm,0,1,2021-03-30 19:55:53
1059,"@PlanningAutumn If I had the time &amp; energy &amp; talent, I could probably co-write a decent book about Downtown Atlanta's storied built environment and title it ""The Context of Demolition."" Putting a tack in that. https://t.co/Iyepez6JlM",Atlanta,atlurbanist,0,5,2021-03-30 19:55:53
1060,"A5 There are some great competitions or schemes of work where students can create digital content linked to mental health awareness, health, well being, advocacy, the environment #CASChat",York,pddring,1,3,2021-03-30 19:55:48
1061,"@ElDuvelle @JamesMHyman @henry_hallock That is absolutely dreadful coverage!

How did they get such good coverage in HCP animals but not ACC? Or did they only see these 'place cells' when the animal wasn't exploring the environment?

Plus their second context isn't a new context, it's a square track.","Cardiff, Wales",jonjwilson,0,2,2021-03-30 19:55:43
1062,"Aight boys, time to drink more coffee to save the environment https://t.co/BaihE5OTWb","Georgia, USA",HarrisonDromey,0,0,2021-03-30 19:55:42
1063,"Stunning green wall at Homerton hospital

Something to look into for the future @NorthMidNHS ? https://t.co/MQK3tWRbJY",,NM_Environment,0,1,2021-03-30 19:55:41
1064,@RadioTfsc You’ve created such a welcoming and supportive creative environment - it’s a privilege to be part of the @RadioTfsc family,,DickleDockle,0,1,2021-03-30 19:55:40
1065,"“Power concedes nothing without a demand.” Frederick Douglass 

The status quo cannot change in an environment of preference for the way things are. https://t.co/8ZCBJVuWif https://t.co/kZrCjj0iwG","Phoenix, Az",DrGaryNGoodman,0,1,2021-03-30 19:55:38
1066,Lego bricks are terrible for the environment. These wooden alternatives biodegrade https://t.co/p6eVTzEvRE,Dublin,canisgallicus,0,0,2021-03-30 19:55:36
1067,"Sorry for holding back. Got a PC now it’s endless possibilities🙏🏽💯. Late nights and early mornings. Giving 100%. If only y’all knew the environment I was in, content creating and streaming is my only escape. Love everyone in Fargo Family from the bottom of my heart🤍.",,DVFARGOO,1,8,2021-03-30 19:55:35
1068,Are you an @UT researcher and interested in learning more on the benefits of moving your research to the cloud and how to do that? Do you want to know about our Virtual Research Environment? #savethedate April19th 15:30-16:30 #themesession #cloudcomputing #VRE #DCC https://t.co/HH4vgSXIv3,"Enschede, Nederland",utwentedcc,0,1,2021-03-30 19:55:31
1069,Highly recommend everyone watch Seaspiracy on Netflix !! The documentary debunks the myth that is ‘sustainable’ fishing as well as exploring the impact of commercial fishing on the environment and its connection with modern day slavery.,London,sxvphia,0,1,2021-03-30 19:55:24
1070,"It means they’re prioritizing themselves for whatever reason. Periods of long rest are JUST as important to the creative process as study or anything else. 

Especially when a creator’s main work is public and online- often a tumultuous and frankly dangerous environment.",,TheOneAzrai,1,61,2021-03-30 19:55:24
1071,"I don’t think there can be any specific amount pegged to this 

It depends on your environment, the economic status and how much you can afford https://t.co/mY0XdZfc1B",,ar3songz,1,1,2021-03-30 19:55:22
1072,"@AVoluntarist These people are massive clowns. I literally saw someone arguing that it's bad for the environment because they plan on using natural gas for rocket fuel. These people have brains so smooth, ISO considered using them for redefining the kilogram.",,restlesskt,0,1,2021-03-30 19:55:22
1073,"@BDliveSA @CoruscaKhaya He failed to do his research of the environment, financial minefield and mess he was going into it. In days to come the saying N-word will be equal to verbalizing the actual word. It shall be called, “the word that shall never be uttered”.",,WolfelFigaro,0,0,2021-03-30 19:55:17
1074,Governor Wike sacks Commissioner for Environment  https://t.co/dR0uBUlZeI https://t.co/3fb0KeDtlN,Lagos,lindaikeji,1,9,2021-03-30 19:55:16
1075,This Temperature Timeline Of Earth Shows Exactly How Nonsensical Climate-Change Deniers Really Are  https://t.co/e7eqehPT64,Tampa Bay Area,petecrosby,0,0,2021-03-30 19:55:03
1076,"Researchers from the @unige_en in collaboration with the @TampereUni_EDU say they have highlighted the critical role of paxillin. Without functional paxillin, the cell is unable to attach properly and slips continuously. Read more: https://t.co/Qwo9a3T8kb https://t.co/xjqXehfhEv","New Rochelle, NY",GENbio,1,0,2021-03-30 19:55:03
1077,"A new plan was presented today that would break up the South Carolina's health and environmental agency as senators move to dissolve it. 

More via @sfretwell83 
https://t.co/0b8SNeWunK",,MaayanSchechter,3,2,2021-03-30 19:55:02
1078,My love for val vs my love for the idea that angel could overthrow him and create a better environment for all his employees as their new overlord,She/her 🇫🇷🇨🇦🏳️‍🌈,frenchPa1n,1,16,2021-03-30 19:55:01
1079,Today the legal change comes into force that marks the end of the long and controversial Matatā managed retreat process. But Greg Fahey is refusing to budge. https://t.co/RntfC7OJgE,Welly,Nikki_Macdonald,1,3,2021-03-30 19:55:01
1080,"""FORTY SANParks employees found guilty of being involved in rhino poaching have been dismissed, Forestry, Fisheries and Environment Minister Barbara Creecy has revealed."" #SANParks #RhinoPoaching #SouthAfrica 
https://t.co/ZEy2JIXjXz","TCU, Fort Worth",Planet_Rhino,0,1,2021-03-30 19:55:00
1081,"@MeghanMcCain I have zero respect for you. 

In today's environment, talk show content is rather heavy, and rightfully so. 

Instead of cordially joining the conversation, you highjack it to showcase your poor attempt at '5th Element' hairstyles.

Maybe focus on that instead of Twitter.",citizen of 🌎🖖& 🇺🇲,dontlickchalk,0,1,2021-03-30 19:54:58
1082,Listen I know we're supposed to be all gung-ho about the environment and hybrid cars but fuck that shit. When they make a hybrid battery that doesn't cost $6k then I'll consider it but until then... Nope I'll stick to gas.,,ALovelierGirl,0,1,2021-03-30 19:54:54
1083,The SNP keep making grand promises to tackle the climate crisis but time and again they missed targets and fail to deliver. The @ScotTories will put the environment at the heart of our plan to rebuild Scotland’s communities. #BBCLeadersDebate 🏴󠁧󠁢󠁳󠁣󠁴󠁿🇬🇧🗳 https://t.co/PsZDzxghWE,"Scotland, United Kingdom ",w2wScotland,0,1,2021-03-30 19:54:48
1084,"cocaine is bad for u kids, it's harvest hurts the people who gather and mule it along with the environment and should u find any u may properly dispose of it by laminating it inside something and mailing it to me","Olympia, WA",coyotedamage,0,11,2021-03-30 19:54:46
1085,"Need an update for your #kitchen, #bathroom, #basement or something new for your outdoor environment. Total Construction is the Total solution. Contact us today. https://t.co/lgoIAXox8K
https://t.co/9yh52kXho8 #totalconstruction",,TotalConstruc13,0,0,2021-03-30 19:54:44
1086,"I always find watching documentaries like Seaspiracy eye-opening but this one has just made me feel so deflated / sad for the people of the world and the environment. Plant based diet is the future, so easy to make swaps! Give it a go to make a positive change #Vegan #Seaspiracy","Nottingham, England",geogcaz,1,4,2021-03-30 19:54:43
1087,"@naomirwolf However, I'm not really worried about the vaccine because 1. the covid protein will only cause same bad reaction covid will cause you 2. it might have other substances. Honestly, how many contaminants and bad chemicals do we already get from our environment, cleaners, etc?",,dmschlom_,0,0,2021-03-30 19:54:37
1088,"Corporate Emissions, Climate Risk Eyed in California Legislature.
Bills by senators @Scott_Wiener @HenrySternCA and @AsmJesseGabriel await hearings. 
https://t.co/ouSv7IW6RE","Sacramento, CA",eDooleyNoted,0,1,2021-03-30 19:54:36
1089,"So Douglas Ross will not work with the SNP on any subject, not sure if that's a responsible option, especially if the subject is good for the environment or people",,DJMacDonald8,0,0,2021-03-30 19:54:35
1090,"Like the other young people tonight, I'm very concerned about the environment. 
The SNP have repeatedly missed their climate change targets.  
Nicola is distracted by other matters such as indyref2. #BBCLeadersDebate",Lochinver,ellarobertson,0,5,2021-03-30 19:54:35
1091,@wlourenco1 @dw_environment @rafucko @cirogomes Did you refer to the one who left the scene to rest the image?,"Minas Gerais, Brasil.",SnowdoSertao,0,0,2021-03-30 19:54:32
1092,"After petition, Built Environment Experts, leading voices in the global green and healthy building community, applaud @WHO’s Release of Roadmap Document on Better Indoor Ventilation to Fight #COVID-19. https://t.co/ShB4W3tLQE @WELLcertified / @AIA_COTE","Oakland, CA",KiraGould,0,1,2021-03-30 19:54:24
1093,Recycled rhetoric and the glaring hole in the Tories’ Environment Bill https://t.co/oJJTIDtj8z via @leftfootfwd,"Trowbridge, England",FrankWinfield4,2,2,2021-03-30 19:54:19
1094,"@sammarelich @JesseTinsley That's fantastic! I haven't seen anyone struggling to raise in this environment, which really has surprised me given the lack of personal meetings/travel. People really made it happen."," NYC, NY & Lancaster, PA",drgurner,0,2,2021-03-30 19:54:10
1095,"@styledbydhillon Hi Tejinder, no one likes to see litter. Here's what we're doing to tackle it: https://t.co/7rN9miDKgB",UK,McDonaldsUK,0,0,2021-03-30 19:54:08
1096,First Majestic Silver Updates ESG Sustainability Activities Aimed at Helping Local Communities and Improving the Environment - Junior Mining Network https://t.co/BxWp2sjBEd,"Stenungsund, Sverige",slaborsproffsen,0,1,2021-03-30 19:54:07
1097,Environment Canada warns of strong winds for Kirkland Lake area https://t.co/hEaE32mnCt https://t.co/IciTQMZO0a,"Timmins, Ontario",TimminsToday,0,0,2021-03-30 19:54:04
