,Content,Location,Username,Retweet-Count,Favorites,Created at
0,"@abeycity25 @omolayoomowunmi @hamzatmohd1 @FerdinandObiora @ShehuSani If you don't understand the concept of Hijab in Islam, then meet me so I can explain. Every Muslim girl child outside there has the right to wear it regardless of the environment they find themselves. Take it or leave it.",,AliyuAbulmalik1,0,0,2021-03-30 20:44:14
1,"Things I’ve learned from Democrats today: Any dog in a new environment around unfamiliar people will bite because it’s natural NOT newsworthy.

Apparently I have the only dog on Earth who has a strong desire to lick every stranger in the face in new environments. #BlackLabsMatter https://t.co/pgFArz4zz9","God’s Country, GA ",RhubarbBrown,0,0,2021-03-30 20:44:14
2,@cvdall And the dog's not wrong! That is a high-security environment and no doubt he's picking up on that.,"Here and there, hither and yon (NYC/Paris)heidi dot n dot moore at gmail dot com",moorehn,0,0,2021-03-30 20:44:09
3,".@vinniewall2 ""From a mental health perspective, I’ve found the claustrophobic environment of a hospital hard over the past year. You can spend hours donned in PPE with foggy goggles. I really value the headspace a bicycle lends to you on a commute, the airy moments of wind on","Dublin City, Ireland",MikeMcKillen,0,0,2021-03-30 20:44:04
4,"@savagediana I went from filling up (48L) every 9 days to just 5 times from April 2020 to now. Must be good for the environment.

Oddly last October I bought a newish car 🤷‍♂️, which has been mostly sitting on my driveway, except weekends when I do a food drop for my mum.",,pratab_a,0,0,2021-03-30 20:44:02
5,"I prefer not to expect from people, I don’t even prefer fighting for myself anymore. I try to keep silent just to provide them and myself peace. I’ve even stopped altering environment according to me, I’d choose walking out with grace. Period.",,Jethanand_Sooth,0,0,2021-03-30 20:44:01
6,Last week there were 3 flights retuning people to Haiti  illustrating either ignorance or disregard for the environment there as well as the  inequality and capricious nature of the virtual wall of Title 42. @WitnessBorder @GuerlineMJozef https://t.co/wWP0z6i7w3,,thcartwright,0,0,2021-03-30 20:44:01
7,"@solomonmissouri IMHO Major is responding to leftover spirits in his environment. Did we ever find out if the WH had a thorough saging, anointing and casting out of demons from the former guy and his ilk? 🤔",SFO • HNL • ✈️ ,revmisscharli,0,0,2021-03-30 20:44:00
8,It’s Excellent news Denise! No AGL terminal at Crib Point. Thanks to Victoria’s Andrew’s Labor government and planning minister Richard Wynn for putting Western Port Bay environment first #auspol #vicpol https://t.co/mY2VzS9pxb,"Melbourne, Victoria",palaceletters,0,0,2021-03-30 20:44:00
9,I have been temporarily reassigned today from my division at UPMC. ###inclusive environment. All woman are welcome at upmc and should be anywhere! #thankTF for the opportunity to know and be who I am and be courageous versus being a coward! I’ve processed it. https://t.co/2eNiAut2py,,LeslieRigglema2,0,0,2021-03-30 20:43:58
10,@Brentwood_BC Well done!!! Really pushing the recycling agenda!!! Amazing for the local environment!! ♻️,"London, England",bev11n,0,0,2021-03-30 20:43:54
11,@KateBennett_DC People don’t realize it takes time for animals to get used to new environments. The White House is HUGE. It’ll take a LONG time for them to adapt to the new environment. Bad behavior such as this is natural in animals as such,,Metalshaymin_RL,0,0,2021-03-30 20:43:53
12,"BWAHAHAHA 
Diversity Program at U. Michigan Accused of Having Toxic Work Environment https://t.co/3EjfOt5Cy6",Front Range of CO Rockies,Taxpayers1234,0,0,2021-03-30 20:43:49
13,@timescolonist Omg...eff off and let Telus build their building....this one building is not going to sink the environment.  Please don’t handcuff Victoria....go pick on some other city trying to build buildings,,Gilligan1131,0,0,2021-03-30 20:43:47
14,"@TonyMurega an @NYS_Ke CANNABIS industry would create employment, reverse climate change, reduce debt, reduce tax, kill tenderprenuership etc

all in 10yrs

disband kazi mtaani, youthfund, stawi, AGPO, @KenyaCIC, prison's enterprise etc &amp; do this

 @MoICTKenya @TransportKE @Environment_Ke https://t.co/R6fu3fkLzk",,DehMao,0,0,2021-03-30 20:43:42
15,"@Laird37712470 @LBC @DanBevJourno FFP3, I believe, is marginally better than the FFP2, but really only in a clinical environment and training. They are immunised now but in the first wave were working with only surgical mask and flimsy plastic aprons. They do still not have FFP2 masks for themselves or patients",,DarrenG12176297,0,0,2021-03-30 20:43:39
16,"@prestonjlamb @fmalcher01 This is what I'm currently doing

https://t.co/G3GEbLX9ru

And

https://t.co/HrNEZ9zSt0

Deploying on Netlify",🚀🏙️,brandontroberts,0,0,2021-03-30 20:43:30
17,"@KateBennett_DC Poor pup, needs a less busy environment. Herding/protection dog, and all that activity is a lot for them to handle.

The Bidens could either hire a full time dog sitter/walker who keeps Major with her and out of stressful situations, or let him live in a quieter household.",The Wilder West,genteelhart,0,0,2021-03-30 20:43:28
18,"@SplatEsse @EmmaVigeland They don’t have to be, you don’t care at all about the environment do you?","Chillicothe, MO",2019mposey,0,0,2021-03-30 20:43:26
19,"@ltgrusselhonore @hammondlastar Damn shame and no help from Sen OilShill CassiDixiecrat who is too busy courting the favors/$$ of the Fossil fuel industry which exploits our environment/resources,makes us ill and contributes 0 to local infrastructure. Our health is no priority for Dr. Shill.","New Orleans, LA",BijouNitsch,0,0,2021-03-30 20:43:25
20,The privileged Brits &amp; every other 1st worlder needs to change. It's as simple as that. https://t.co/ilde8oQawC,"Earth, pale blue dot, 1 planet",JunagarhMedia,0,0,2021-03-30 20:43:22
21,"@ouinne also haven't they said the dogs aren't trained at all? 

what a terrible environment for a german shepherd (all dogs need to be trained to some degree, some need it a lot more than others to be safe and happy)",,collectdust,0,1,2021-03-30 20:43:20
22,sometimes you just gotta outgrow your environment,"Alberta, Canada",polo_keys,0,0,2021-03-30 20:43:18
23,"@FLDEPNews “Coordinating with stakeholders”? In other words, effing over the environment in the name of big business? Do your *jobs* &amp; protect the #environment. This is an unacceptable solution. Find another way than #poisoning our Bay. (@VernBuchanan - do something!)",United States,kkblaze,0,0,2021-03-30 20:43:04
24,"I feel like I’ve gotten a handle on optimizing environment elements for games and now it’s time to learn blueprints and shader creation and put it into practice. Going out of my comfort zone and doing an outdoor, stylized, playable (hopefully) environment. Let’s give this a go.",,Shanee223,0,0,2021-03-30 20:42:57
25,And in an almost universally sympathetic media environment. Imagine how it would be if he was getting smeared daily from all sides https://t.co/pL2HPTgxs9,"Wedding, Berlin",Alexgriffiths,0,0,2021-03-30 20:42:42
26,"@SplatEsse @EmmaVigeland It’s bad for the environment. Protecting the environment is the job of the government too. Call it what you want but I’m glad the US has standards like you can’t dump waste were you want, you have to be connected to a sewer system. Is that authoritarian too?","Chillicothe, MO",2019mposey,0,0,2021-03-30 20:42:41
27,@isobelroe Dan Tehan on ABC just now blaming the states?! Come on now this is beyond insane. What do the Feds do?!! Other than make women feel less respected in an already clearly unsafe environment,"Woollahra, Sydney",AldridgeHenry,0,0,2021-03-30 20:42:32
28,"""Environmental DNA, or eDNA, can help identify who’s in a river, stream or creek. Now, it’s helping scientists learn how threatened salmon and trout adapt to a changing environment"": https://t.co/7LdX1QKLsB","Portland, OR",kettlemoraine,0,0,2021-03-30 20:42:28
29,"@CovidWomenVoice @DorothyBreen2 @NWCI @GColleranMD @aoibhinn_ni_s @niamh_dr @newschambers @SAFEIreland @marietcasey So I agree completely with everything and everybody here (not like me haha, but this is that bad). The only thing I want to add... Maybe that’s  why we need to elect more women the next time. And I know we need more women to run and for the environment to enable them etc.","Dublin City, Ireland",Enida_Friel,1,1,2021-03-30 20:42:27
30,i just quit my job bc of the hostile work environment then another job opened coincidentally for a nail salon 🥰🥰🥰🥰🥰🥰🥰💕💕💕,tx,haliereyess,0,0,2021-03-30 20:42:23
31,"“NFTs aren’t as bad as other things that ruin the environment so who cares?”

You’d rather contribute to this trash than at least TRY to reduce it???",Soup,TheBenturion,0,0,2021-03-30 20:42:20
32,"@Breaking911 the domesticated dog behaves in an anxious manner when in a abusive environment.
Basically, Biden and his employees could be abusing the dog.",,jayRNair,0,0,2021-03-30 20:42:19
33,"We are looking for instructors nationwide.

Would you take action for the environment?

Would you be a part of the frontline advocates for climate changein Nigeria?

Let me know in the comments. Details will be shared tomorow.

Attached are climate change books i have authored...",Global,GloryOguegbu,0,1,2021-03-30 20:42:15
34,Corals may need their predators' excrement #environment via: @sciencedaily https://t.co/vKqG1L5pO1,,TRVST_Env,0,0,2021-03-30 20:42:11
35,God provides ONLY the Seed. The fruit comes after the seed goes through the right environment and conditions.,,JohnKambole199,0,0,2021-03-30 20:42:11
36,China accounted for half of coal-fired electricity in 2020: report https://t.co/gwnvAXBgXx China won't likely stop building coal fired power plants I don't think they believe in man made climate change and we shouldn't ether.,,bruce_schlink,0,0,2021-03-30 20:42:09
37,"Let's take a look at the relationship of Average Days on Market to Inventory. If you're curious about how this affects our real estate environment, don't hesitate to reach out.

Tracy Hinterman, REALTOR, GRI, CRS https://t.co/AfP7okJZpo https://t.co/enD271QNtp","Texas, USA",HandygalTracy,0,0,2021-03-30 20:42:08
38,It’s not his fault tbh. He’s overwhelmed by the environment and there are just too many strangers coming and going. https://t.co/QebF09bNKF,"Atlanta, GA",admitchellGA,0,0,2021-03-30 20:42:00
39,"Is there any non-hacky way to find out what the current foreground color is in SwiftUI? @Environment(\.foregroundColor) is not allowed, apparently. 🙂","Stockholm, Sweden",memfrag,0,0,2021-03-30 20:41:58
40,"Poor Major. This environment isn't good for him at all.

President Biden's Dog Major Has Another Biting Incident https://t.co/z7yBYKUyjq","Georgia, USA",bazylitch,0,0,2021-03-30 20:41:53
41,"@sislinchu DLM, seems you have been under big pressure at your new position, it could just be a teething problem or it could be the environment actually you cannot cope with. If it's the later one, quit it then.",,CurryBeef3,0,0,2021-03-30 20:41:53
42,He’s a dog. In a stressful environment. Dogs bite people. https://t.co/29D1SDVa7B,,DavidBenjaminF,0,0,2021-03-30 20:41:49
43,"@MollyJongFast Poor baby💔💔💔

He’s just nervous n flustered by all these strange people coming n going in a new place!!

He needs time patience love n support in a controlled, STABLE environment.

Hope Bidens provide that for him, Major just wants a place n people to call his❤️",,leateafly,0,0,2021-03-30 20:41:46
44,"i’m sooooo fucking sickened by this saweetie shit.

imma be real with y’all. you can say whatever the fuck you want, but I KNEW QUAVO WAS TRASH BC LOOK AT THE ENVIRONMENT AND CULTURE. y’all think cardi is “crazy” for going back and forth with offset??",nyc,mounapdf,0,0,2021-03-30 20:41:40
45,"@MollyJongFast He’s the wrong kind of dog for that environment. I’m sure he’s a great animal, but...","Portland, OR",theRealWedgeA,0,0,2021-03-30 20:41:38
46,"@The__Goomba I’d buy into the sequel being them having an intelligent discussion, they probably have a lot to say about the environment. And doesn’t Godzilla have two brains? 🤔",Manchester,metalgario35,0,0,2021-03-30 20:41:36
47,"Join us tomorrow (Wed) @ 11am for the #Zoom Café brought to the community of #Cork &amp; #Kerry by the Health &amp; #Wellbeing Community Referral link workers. If you are looking to connect with others in a friendly, supportive environment, pull up a chair &amp; join us! PM for the zoom link https://t.co/Pv3AB0kuYs","Mallow, Co. Cork",EFoleyMallow,0,0,2021-03-30 20:41:23
48,"Even after the rains, Australia's environment scores a 3 out of 10. These regions are struggling the most https://t.co/SkuC0nO1P5 via @ConversationEDU","Ballarat, Victoria",janenetrickey,0,0,2021-03-30 20:41:23
49,"#Sold 📸
Upgrade Your Ride Today With A Quick, Easy And Hassle Free Environment.
See You Soon, 
Joshua Simmons
Classic Acura
1000 Interstate 10 North
Beaumont, Texas 77702
https://t.co/qNBgwutWgd💻
#1VolumeLuxuryDealer 
#SETX
Direct: 409-273-1862☎️ https://t.co/F41xM64CMf",,JoshuaS54076132,0,0,2021-03-30 20:41:21
50,"@morninggloria I have to blame Biden on this one. He put his friend in an environment that is extremely crowded &amp; where there are complete strangers at every turn.

This would be a rookie mistake for someone who didn’t know any better, but a serious error for one that has had a dog for years.",,Bradford__Lee,0,1,2021-03-30 20:41:18
51,"I have to wonder how safe am environment Dr. Burks created for women (and men) - of any color - working for her.

@meganranney tells us “male-centered” and “toxic” was the problem. is it?

I have reported to women of the boomer generation who advise this:

https://t.co/iwmigq3hrH","Cambridge, MA",usnehal,0,1,2021-03-30 20:41:12
52,"Dogs know who to trust and who not to trust.  Although the high traffic environment doesn't help, he's reacting that way for a reason. https://t.co/FNYfgzDKAx",,L_M_Fisher,0,0,2021-03-30 20:41:10
53,"#Local #MusicFamily …LongTermCare..ShortTermRehabilition..MemoryCare..PhysicianServices ..SeekingQuality..Professionalism..FamilyFriendly Environment? ....Contact #PleasantView #ShiawasseeCounty MedicalFacility 275CaledoniaDrive..OwossoMi #48867  

https://t.co/mZ1h3615qb","Owosso, MI",RockinWOAPRadio,0,0,2021-03-30 20:41:05
54,Environmental antimicrobial resistance driven by poorly managed urban wastewater https://t.co/GGsjAsxQmN #environment #water #waters #wastewater,Finland,Dragofix,3,4,2021-03-30 20:41:05
55,Farmers in smart farming project identified 9% cut in carbon emissions https://t.co/9rWgVLx9u3,Ireland,IrishTimes,1,5,2021-03-30 20:41:03
56,"@SECowell Yeah 🚀 Gaming might pave the way for broad micropayment mass adoption, IMHO. This is a massive USD 150 billion industry growing 10% annually, populated by early adopters, many unbanked. It seems an obvious environment.","Eimsbüttel, Hamburg",Steffen27837816,0,1,2021-03-30 20:41:02
57,@NotCyp He is overstimulated and his needs have not been met. He needs to talk to a counselor away from that environment and figure out what is causing that behavior. I know how they treated kids like my brother and I know it’s not entirely on the autistic kid.,,MagicalAidol,0,3,2021-03-30 20:41:01
58,"@IwriteOK Yes! Any dog would be stressed out in a new, crowded environment with strangers coming and going all day. German shepherds are particularly not suited for that. This is the fault of Biden or whoever else thought this was a good idea.",,kristenoy_,0,0,2021-03-30 20:41:01
59,"@Todd111111111 3. Hygiene explanation fails with polio. Outbreaks even in the hygienic 1950s, because sanitation made polio more prevalent, because it reduced contact with polio virus in environment that sometimes conferred natural immunity—so dirty environment acted like a crude vaccine!",,JonathanSarfat1,0,0,2021-03-30 20:40:57
60,"""observing creatures affected by this"" 

Z could be short for Zephyrus, the code name for phil.
what if the only reason phil let ranboo stay was so he can observe him in a close environment? https://t.co/0FdVcOxQZ8",your telephone calls,sleepycatrdoras,0,2,2021-03-30 20:40:54
61,@kay_sussex @samlau000 100% with you. Clean environment. I love it.,,StevenKimFudgel,0,0,2021-03-30 20:40:53
62,"I know I'm a writer because my sexiest fantasy is a workshop environment where the only feedback I receive is ""This is so good, I really have no notes.""",Hampton Roads,ShannonJCurtin,0,0,2021-03-30 20:40:50
63,I can’t think straight in a dirty environment,"WESTMONT, CA",K_J0hns,0,1,2021-03-30 20:40:48
64,@lisswolverines @mitochondriamor Couldn't they just trade their monopoly money WITHOUT also destroying the environment? No?,USA,heyreynard,0,0,2021-03-30 20:40:44
65,@AverageG4merYT console games are made on a pc for console usually in a virtual console environment really depends on what you are doing.,,GH0ST_MERC,0,0,2021-03-30 20:40:41
66,@gtconway3d Major needs a handler at the WH to work with him in the environment.  I'm sure Major senses slot of bad intent by others towards his owner.,"Pittsburg, CA",Togethersane,0,2,2021-03-30 20:40:41
67,@Haunted247 @truthhurtscuh @TheAthletic @NFLBrasil To be clear - I’d probably lean fields &gt; Wilson but both have high quality traits to succeed. Whoever has the better career will likely be determined by environment,"New York, USA",DSP4150,0,0,2021-03-30 20:40:40
68,"@theRealKiyosaki 
After i read your rich dad poor dad book, i gave it to a friend so he could read it too, but i don't think he liked it as much as i did. I read your book when i was 14½ y/o (3 months ago), it realy shifted my mind and saved it from the bad environment arround me",,ChrisStange3,0,0,2021-03-30 20:40:39
69,"@matthewkeevil I just think they're pushing people into unsafe spaces by doing this. At least at restaurants, it was a controlled environment.","Vancouver, British Columbia",VanIRPickering,0,1,2021-03-30 20:40:37
70,3/4 That is why @spekitapp wowed me from the moment I met @melfellay - Spekit provides contextual learning presented *in the flow* of work to employees. Employees must be forever learning and adapting in today's technology-rich environment and Spekit enables them to do so.,Boulder mostly; SF sometimes,susanwolff,0,0,2021-03-30 20:40:34
71,"""Fostering an inclusive and diverse environment is, I believe, part of our societal mission... It is something that we need to be all working together on if we want to make a difference. "" - Dr. Francois @Perreault_ASU  https://t.co/6WGdWQZmvV https://t.co/iaM9c3IByF","Houston, TX",NEWTCenter,0,1,2021-03-30 20:40:34
72,"@KingMace87 @Nigel_ITBassest @LilyLady2 @CraigVecellio @lpky Most jobs working on the pipeline were construction jobs. Yes its bad that they lost the jobs, but they can also find jobs with solar and wind power, plus those are less harmful to the environment",😏,Juanito__3,0,1,2021-03-30 20:40:31
73,"@JeromeAdamsMD No scientific data shows the human body being incapable of fighting Covid-19. No data is shown on natural immunity, blood type, how we get all diseases from meats, processed foods and through the contaminating of our environment. So much real science is missing. All for profits.","Ohio, USA",iamjasonsteward,0,0,2021-03-30 20:40:28
74,"@ziza_lee @ElleCadne I agree, except the product was used in the most sterile environment which then doesn’t make it a fair test.  I do expect to see some growth however minimal after more days",United States,cassy_collins_,0,0,2021-03-30 20:40:25
75,@kyry5 Sometimes you have to bail. I had a divorce interrupt my degree but the branch I wanted to go into was not sustainable and if I went another route poor impact on people and the environment. (Design but sweat shops😞) wanted theatrical but making a living 😑 also it was intense,your fridge eating your cheese,micearenice1,0,0,2021-03-30 20:40:25
76,"@mayapetitee @jiggyjayy2 Thank you. I have had a similar experience. I also have a CNC and DDLG fetish that I feel were created through trauma. 

I can't speak for everyone but it makes me feel empowered in a way because in the very controlled environment, I chose the person doing the things to me.","San Diego, CA",ScarsAdventures,0,0,2021-03-30 20:40:22
77,Some doggos might need professional training to handle over-stimulation from busy environment. All three-year olds can be difficult at times...I know I was.,,janggolan,0,0,2021-03-30 20:40:22
78,@IAmLui_Jesus Would attend.  That's the only time I kinda felt out of place? But I still met some people and practiced with them.  But it was a definite change in the environment.  But overall not to shabby.  I was and still am relatively new to the scene but it's been a positive exp. /3,In my bed,LowenVonEdmond,0,0,2021-03-30 20:40:21
79,My job is garbo and if my super tries to fuck me over I'm going for fucking blood on targeted harrassment in a toxic work environment that the director's boss and whole of HR have a LOOOOOOOONG history of notations about and  refuse to even pretend to work on," (,,⊕︿⊗,,)",LunarDiviner,0,0,2021-03-30 20:40:17
80,"@KateBennett_DC Poor baby💔

He’s just nervous n flustered by all these strange people coming n going in a new place.

He needs time patience love n support in a controlled, stable environment.

Hope Bidens provide that for him, Major just wants a place n people to call his❤️",,leateafly,0,0,2021-03-30 20:40:16
81,@GretaThunberg @MCRyouthRebels @Greenpeace @foe_us The #ApartheidIsrael destroys not only the lives of the Palestinians but also their environment and livelihoods as they try to dvict them from their land illegally. #PalestineLandDay https://t.co/S1sE4mtz08,,ChristineJameis,0,0,2021-03-30 20:40:16
82,"@AlboMP Environment, Climate Change, Infrastructure please","Sydney, Australia",acmejc,0,0,2021-03-30 20:40:13
83,"Pleased to join this session tomorrow titled “Dignity by Design” facilitated by the Institute for Human Rights and Business.
As countries seek to address climate change &amp; rebuild from COVID-19 shut downs, the built environment – both real estate &amp; infrastructure – is important. https://t.co/suce1smPSQ","Johannesburg, South Africa",drtlaleng,0,2,2021-03-30 20:40:10
84,"@chris_dolan It’s almost like killing and eating wild sealife on an industrial, global scale isn’t good for the environment 🙄","Liverpool, England",edwards2779,0,0,2021-03-30 20:40:10
85,"Why Affiliate Marketing?
Just like most passive income opportunities, Affiliate Marketing let’s you work when you want!
You’re free to work in a flexible schedule and environment of your own choosing.  And you don’t have to worry about any after sales customer concerns. https://t.co/jrH5IEMt0x","Melbourne, Victoria",ElioMirabella,0,0,2021-03-30 20:40:07
86,"@neitouuuu - and that power is sourced from the burning of fossil fuels.

Since it so intensive and demanding, lots of energy is burnt and carbon dioxide is emitted. This is why it is so harmful for the environment.",Nomad's Office,Markymis,0,1,2021-03-30 20:40:04
87,@Julie_A_Smyth @BBCNews Conservatives are about the environment too. Shes a left wing activist though. She is clearly left wing.,,BritishAlba,0,0,2021-03-30 20:40:02
88,"Why should we #recycle? When you transform something old into something new, it benefits the #environment in a number of ways. Learn about the importance of recycling just in time for #SCAEarthMonth! ♻️ #SaveOurSphere 

https://t.co/woMucRVjvh",Parks & Forests everywhere,the_sca,0,0,2021-03-30 20:40:00
89,"In your opinion, @LoJackson94, what environment is more stressful for a head coach. College or NFL? https://t.co/4D91R31FYa","Morgan Hill, CA",DWiseAC,0,0,2021-03-30 20:39:59
90,"I can only recommend the amazing @HepvirTeam. Honestly, @David_Durantel and @julie_lucifora are the best PhD directors I ever had. And @CIRI_Lyon offers the perfect scientific environment to study viruses. 
#HBV #HDV #postdocjobs #PhDposition https://t.co/Rjs3mIOu8F","Heidelberg, Germany",SFaureDupuy,0,0,2021-03-30 20:39:53
91,Feeling at home: Structure of the NTSR1–G i complex in a lipid environment | Nature Structural &amp; Molecular Biology https://t.co/Bdwwav79RP,"Boston, MA",miao_gui,0,0,2021-03-30 20:39:52
92,#DWTDTAOSO is a really interesting doc! I did Demi’s nails once (pic) during what must have been a really low time in her life. You’d never have known. She was really friendly and made me feel at ease in what was a super stressful/new environment for me. Thanks @ddlovato 💗 https://t.co/1wXw6YqMWY,EAST/LONDON,AsherColeman,0,0,2021-03-30 20:39:50
93,"Hi @ScottMorrisonMP, @sussanley, @Birmo: you and I know BOLD action is required to tackle #ClimateChange. I urge you, please set out a plan to reach net zero emissions by 2050. The longer we wait the worse it will be for our economy, environment and health. #EarthDay @GlblCtznAU",,JPellone,0,0,2021-03-30 20:39:49
94,I need structure and lots of it but the environment needs to b created by me but I am so disorganized how tf will I create structure 😭😭 this is my life,"aqua sun, cap moon, ? rising ",imrizzay,0,0,2021-03-30 20:39:47
95,"@adamscrabble Honestly though, it sounds like a terrible environment for a dog. Not a stable/relaxed situation",,JustSumDoodYo,0,1,2021-03-30 20:39:46
96,@Citizens4THubb Doesn't have anything to do with black families.  It has to do with the environment and how uneducated you are.,63118,StLouisCityPhot,0,0,2021-03-30 20:39:36
