,Content,Location,Username,Retweet-Count,Favorites,Created at
695,"The threat environment of terrorist financing grows increasingly complex. My chapter in the Counterterrorism (CT) Yearbook 2021 proposes several recommendations for potential policy options.
https://t.co/jjVSIx0GzL",Canberra,LaksmiSylvia,0,0,2021-03-30 20:11:17
696,"CA6: affs employer's MSJ on employee's claims of hostile work environment sexual harassment, retaliation, and FMLA https://t.co/lfzloKHCb0 @DRIAppellate","Dallas, TX",AppealsCRKA,0,0,2021-03-30 20:11:16
697,"i also have little to no power in helping any of these living wages, environment and societal issues. i have no money and no power. but people with 300mil can just come in and nuke the housing scenes into high heavens.

being alive kinda blows.",The Shadow Realm,N_nem_nem,0,0,2021-03-30 20:11:15
698,Individually designed built quality villas in Rawai Phuket: A small Development of individually designed built quality villas.   The ideal place for those seeking a charming and comfortable environment away from the… https://t.co/22cm1xvPKv #realestate #topproperty #properties https://t.co/HrD4KXJ8U7,Global,topclassvillas,0,1,2021-03-30 20:11:14
699,"I'm not going to claim to be a virologist, pathologist etc. But I have been highly credited for extremely safe working practices in my environment and diligently so. Can someone please explain to me how masks are preventing the spread of infections??",england,wantingfreeback,0,0,2021-03-30 20:11:11
700,"When you’re going to market as a built-environment tech startup, it can feel a bit like trying to eat an elephant.

Or maybe a woolly mammoth; our industry can be a little stodgy, after all.","Atlanta, GA",shadowventures,0,0,2021-03-30 20:11:04
701,"@ameisen_strasse What's your issue with reticulate? (usually, I suffer when setting up the environment, but once this is done and as long as I don't need to play with n-dimensional arrays, this is pure joy)","Constance, Allemagne",Ben_Guinaudeau,0,0,2021-03-30 20:10:58
702,@Bloody @ghirapurigears @wizards_magic This limited environment is gonna be bananas.,"San Diego, CA",Treeroy6670,0,0,2021-03-30 20:10:53
703,"@themajestically Extreme wealth so I could do what Gates does.
Extreme health for my age.
An end to all authoritarian, repressive, fundamentalist something or other, expansionist, environment &amp; ecology destroying politicians, boards &amp; CEOs.","Victoria, Australia",GedyeMarian,0,0,2021-03-30 20:10:50
704,Wike Sacks Commissioner For Environment https://t.co/AQglxmFBRc,"Lagos, Nigeria",9jalinksmedia,1,2,2021-03-30 20:10:49
705,@plsleaveamsg One of the reasons I don't have kids..I want to provide and environment where they have time to think and really figure out what they want and who they are.. opposed to a environment they're trying to escape from asap,Leaving Earth,LazyConcious,0,1,2021-03-30 20:10:46
706,"@JoshSlocum So it's like an inborn trait that a person is predisposed to, but the trait isn't expressed unless the person is in a certain environment?","Hell, for not changing my ways",NigelThePussy,0,0,2021-03-30 20:10:46
707,@Tee_fleur Venting can be a form of shedding if in the right environment.,Utah not Colorado ,Thekendoslice_,0,1,2021-03-30 20:10:44
708,"@elonmusk @Ozzylonso Nobody cares down here Mr @elonmusk. I’m a Republican who cares about his environment more than space frontier. You’re using Mr Nikola Tesla’s name in vain, he tried to give people free energy not electric cars ones has to pay for smh.","Los Fresnos, TX",ProdigalSon1132,0,0,2021-03-30 20:10:44
709,I get paid so much because they know this environment is toxic as fuck,"Bolingbrook, IL",broannaspyro,0,0,2021-03-30 20:10:40
710,"I am looking for a postdoctoral researcher in the area of sensorimotor neuroscience. Start date around July (but negotiable).

Penn State has an excellent and supportive environment for sensorimotor control research. Job ad below: 

https://t.co/RDRxCJgs5A

RTs appreciated.","State College, PA",TarkeshRSingh,11,5,2021-03-30 20:10:33
711,#LastWeek1101 The claim was oil use and businesses in North Dakota directly affect the environment there.,,__KevinDaniels,0,1,2021-03-30 20:10:29
712,@anglscry Wtf I am so sorry.. I hope u would be able to move out of that toxic environment soon,md | 🇬🇲🇸🇱,notbbysia,0,1,2021-03-30 20:10:17
713,"It will be a superb scheme and is exactly what the new working environment needs. 
.
#sustainablefuture
#netzerocarbon 
#nzc https://t.co/zu4O36aL4h",Borough Market London SE1,UnionStPartners,0,2,2021-03-30 20:10:13
714,"Put on a pot of coffee, I have to fill the tank:  #Missouri S&amp;T Researcher Working On Pumping Biogas Directly Into Vehicles https://t.co/QA6mqy1lCW","St. Louis, Missouri",christoferguson,0,0,2021-03-30 20:10:09
715,"I don’t get the idea of keeping restaurants &amp; bars open while cases go up like this, these settings literally INCENTIVES people to hangout with their friends. Our province has created an environment that makes you feel like you shouldn’t care about being safe cause you can go out",Canada,_skyevans,0,2,2021-03-30 20:10:07
716,"We should protect our #environment better, so we can still #enjoy such views in the #future. #SouthTyrol #Merano #AltoAdige #Nature #Alps https://t.co/eQbwauxezl","Stuttgart, München, Birmingham",semodu_ag,0,1,2021-03-30 20:10:02
717,: Why Does It Rain So Much in Spring? https://t.co/KkDEgFJ3R4,,SciSeekFeed,0,0,2021-03-30 20:10:01
718,NoSQL: Environment Setup &amp; Installation on Windows - https://t.co/67wWJFFnZg   #Developer #node #nodejs #coding #js #angularjs #vuejs #reactjs #100DaysOfCode #webdev #coder #tech #javascript #html #php #womenwhocode #301DaysOfCode,,codewallblog,8,6,2021-03-30 20:10:00
719,"Racism is a pernicious scourge, especially in the work environment, as it ends all enthusiasm at work and leads to frustration, which ultimately harms the interest of work. #environment #leadership #inclusion #diversity #antiracism",,RashaAlkhadra1,1,0,2021-03-30 20:09:59
720,".@GovWike has sacked Igbiks Tamuno, the Rivers' commissioner for environment.

Reports have it that Tamuno was sacked while he was addressing journalists in the state on Tuesday, March 30.

https://t.co/wapkeNaDDZ","Lagos, Nigeria",legitngnews,2,6,2021-03-30 20:09:59
721,@Maryamization @TaleaMayo I think you can do something like begin{block}{Theorem 1}. \end{block} and forgo theorem environment.,"Billings, MT",TChihMath,0,0,2021-03-30 20:09:56
722,"Are you looking for an opportunity to mentor young people in a community-living environment? Apply today to be a Resident Leader for Act Five, Redeemer's gap year program! The complete job description is available below. 
https://t.co/iUkjA5lMfu https://t.co/Azgh3PszzH","Ancaster, Ontario",RedeemerUniv,0,0,2021-03-30 20:09:52
723,"Learn about why Indigenous groups are leading the fight to #StopLine3, why it is a risk to our water, environment, and #climate, and how @POTUS Biden's administration could intervene to stop it.

From @jarielarvin in @voxdotcom 

#BuildBackFossilFree

https://t.co/xRe6RT0eQU",United States,cleanh2oaction,1,1,2021-03-30 20:09:51
724,"@KFILE I have the world’s most wonderful dog, yet he would not be able to handle the chaos of the White House. Handling that sort of chaos seems like a big ask for any animal not raised in that environment.",,ounceofprevent1,0,0,2021-03-30 20:09:50
725,"Disease outbreaks more likely in deforestation areas, study finds https://t.co/Dlq1BlZolR",northern cali,butzbach2,0,0,2021-03-30 20:09:50
726,"#HongKongSAR #ElectoralSyatem The new electoral system will help foster a better political, social, legal and business environment and usher in brighter development prospects for Hong Kong.  
https://t.co/465LBopa3F",Vancouver BC Canada,ChinainVan,0,1,2021-03-30 20:09:49
727,"@philosoraptor Meh...I know they’re good for the environment but they also increase the likelihood of yeast infections and BV.

Fun fact, the first time Mary Jane saw a bidet (in France), she assumed that was just how those weird Europeans washed their clothes.","Atlanta, GA",JudgyJosie,0,0,2021-03-30 20:09:43
728,"@charliefox_1984 @parismarx Did you read the article?
How do you rebuild the global economy to the state it is now without utterly destroying the environment?
I don't support fossil fuel companies at all, I just know that we can't spend our way out of this.",Cold province in Atlantic ,CarolBurnit,0,0,2021-03-30 20:09:42
729,"@OreoBc Looks like a very warm place based on all the sand, sandy environment = heat. I'm sure they'll dry up fast. ^-^",Your older sister's room,DoggoMeato,0,0,2021-03-30 20:09:38
730,The texture of Bengali is made of leftleaning threads and those who haven't they pretend to be.bengal's natural environment plays a significant role to facilitate growing such mindset.,Kolkata,sanjoyC70389661,0,0,2021-03-30 20:09:33
731,Nothing worse than living in a uncomfortable environment. God please help .,,_TahJah,0,0,2021-03-30 20:09:32
732,The stock market could double by 2030 because COVID has ‘utterly changed’ the policy environment: analyst - MarketWatch https://t.co/PIOTk98r73,Bessemer,alaskarebel,0,0,2021-03-30 20:09:30
733,"@Just_Lipstick @ABC I’m not defending this necessarily, but what is Biden supposed to do as an alternative? When you have thousands of people desperate for help and lack the infrastructure to keep them all in an ideal environment, what do you do?",,isabellegirl5,0,1,2021-03-30 20:09:30
734,"11/11 shy hypnotist shy hypnotist shy hypnotist shy hypnotist
practice on me! let me give you a safe and friendly environment to do so in!!
Then maybe become really dominating once you have confidence",The Cloud,darmenzi,0,3,2021-03-30 20:09:26
735,"The Detroit Tigers top draft pick, Spencer Torkelson, finished spring training going 1-for-26 with 16 strikeouts.  Maybe the Tigers should re-think moving him defensively and allow him to grow his skills, esp. his hitting, in a less pressured environment.",United States,totallytigersbb,0,2,2021-03-30 20:09:25
736,"@Ohlac3D Oh I want to live in that tranquil little house! It all looks so peaceful, you captured the environment beautifully",Las Vegas,MyManOryx,0,2,2021-03-30 20:09:25
737,"""I think Anas Sarwar is coming across really well"" says girl who cares about environment but who also wants to park 120 more nukes on the clyde. Where do they find these people?",,AnimeSeiji,0,0,2021-03-30 20:09:18
738,@nursesKidONE @DiverseAlz Agreed. Personal hygiene and housework are different in my view. But you do need to have a healthy environment.,,dgaet59,2,3,2021-03-30 20:09:16
739,oh god oh fuck I’m in an environment,"Brooklyn, NY",jpbrammer,47,363,2021-03-30 20:09:14
740,I went from an amazing work environment to a toxic one and I definitely took that for granted,"Clinton, IA",alyssabaker033,0,0,2021-03-30 20:09:13
741,"your utopia, extended, becomes my environment, exploitable",,handicapstanda1,0,1,2021-03-30 20:09:13
742,"@Murphlemurph I think that managing your own feelings of judgement takes emotional intelligence and support from those around you, a difficult process but in a well supported environment these feelings should not have any impact of the service provided. #otalk",,bethany_bate1,1,4,2021-03-30 20:09:13
743,"@RockyMountViews I want them! If hotels can offer guests smoke free rooms and planes can offer nut-free flights, why can’t passengers enjoy Covid-free flights?

And ornery anti-vaxxers &amp; anti-maskers cannot be allowed to dictate how safe an environment is.

Vaccinate &amp; mask up!","Martha’s Vineyard/Bethesda, MD",PamCob,0,3,2021-03-30 20:09:09
744,"@WritingByErica I’m not sure where you live so this may not be helpful but in some states, a toxic work environment or suddenly reduced hours, etc., can be considered forced to quit and thus eligible for UI benefits.","California, USA",lasher916,0,2,2021-03-30 20:09:06
745,Regent honeyeater: Endangered bird 'has forgotten its song' - BBC News https://t.co/p8NVNiMggY,,GruinGrunn,0,1,2021-03-30 20:09:04
746,"@RossLambieConsv Terrible take on the environment though aye? Absolutely gassed any sort of ambition on this. Real shame, conservatives need to do more on conservation.",UK,tony_prn,0,0,2021-03-30 20:09:02
747,"In our diverse work environment, you’ll be inspired by colleagues &amp; empowered to exercise your imagination on real-world challenges. Thermo Fisher is hiring in #Gothenburg, Västra Götaland County! https://t.co/ieIRZXUYQc #Pharmaceutical",Worldwide,tmj_pharmjobs,0,0,2021-03-30 20:09:02
748,@DRE777_ make sure u in an environment and around ppl that u feel safe or free with... bring snacks/food... make a playlist... nausea is normal...,rollerworld,modsiwaisa,1,0,2021-03-30 20:09:00
749,"While watching #Godzilla: King of the Monsters, they point out how the environment recovers after the monsters destroy cities and then show Las Vegas, San Fransisco, and other cities where massive monster battles occurred covered in heavy vegetation, and I’m just like, “So no one",,rampagelephant,0,0,2021-03-30 20:08:56
750,My mom gets vaccinated this week and I’ve never been happier with her decision to go back to a safer work environment after retiring. Slow steps to seeing my family again 💞,Canada,torrylynnxo,0,1,2021-03-30 20:08:54
751,Java's coding environment is the most attractive one!!😏🤙🏼,🍭🤍,radhikastic,0,0,2021-03-30 20:08:53
752,"@CozyYote To waaay over simplify it, all cryptocurrencies are fake money (I mean what isn't tho honestly) that consumes ridiculous amounts of energy to transfer from user to user and leaves a huge carbon footprint. The process is horrible for the environment",Upstate NY,Bat_Bites,0,1,2021-03-30 20:08:52
753,Great to see the new trees planted and pavement resurfaced on Bourne Avenue. This is part of @RDGLabourCllrs ongoing investment in making it easier to travel around Reading while helping the environment. #rdguk https://t.co/jEHvHBTR5H,"Reading, England",liamchallenger,2,7,2021-03-30 20:08:52
754,@Lyahtta because its a positive environment for people who just want to take it easy and like having a music / overwatch noise bot in the background,,7D7SE,0,0,2021-03-30 20:08:44
755,"We’ve got some great opportunities available for the Summer and even a couple spots this Spring. If you’re looking for valuable coaching experience in a fun and intense training environment, let us know!

➡️ https://t.co/I3mGGp4677 https://t.co/soXh7OxTkD",Texas & Oklahoma,PCnowisthetime,8,6,2021-03-30 20:08:37
756,Rivers governor sacks environment commissioner https://t.co/RnnbdSlBTj,,NigeriaNewsdesk,4,1,2021-03-30 20:08:33
757,"After the recent heavy rain fall and flooding, all swimming sites may still be impacted by storm water pollution today.
For details, check the website: https://t.co/stQZFzRsSv
For info on local conditions please contact your Council or lifeguards.",At the beach,BeachwatchNSW,0,2,2021-03-30 20:08:32
758,The U.S. #Environmental Protection Agency defines hazardous #waste as any solid waste that could harm #human #Health or the #environment.,WORLDWIDE🌍,FiyyazAhmed_06,0,1,2021-03-30 20:08:31
759,"This is all about planning for the future and protecting the #environment,” said CWM spokesperson Jackie Lang, “making sure that dangerous materials and potentially dangerous materials are managed safely in the years ahead.",WORLDWIDE🌍,FiyyazAhmed_06,0,1,2021-03-30 20:08:27
760,"#COMPANY_06
#Channel_09
#Environment_06
#environment
Hazardous #waste landfill in Arlington plans expansion

The company operating #Oregon’s only hazardous waste landfill says it needs room to grow as it anticipates an influx of waste in the years to come.
https://t.co/tulcE7iyB7",WORLDWIDE🌍,FiyyazAhmed_06,0,0,2021-03-30 20:08:26
761,"He's a young German Shepherd in an unfamiliar environment packed with large numbers of unfamiliar people, plus every time I've seen someone walking him they're on their damn phone and not paying attention to what he's doing. Who's surprised? https://t.co/uU49i6SspE","North Cack baby, not a boss ",ResearchBuzz,0,5,2021-03-30 20:08:22
762,@GerryHassan @Douglas4Moray @AnasSarwar Anas did well at the end calling Dross out on his partisan pish regarding working collaboratively on environment. Overall he was pretty bland. Murray was creepy and his phony one line retort jarring and robotic.,Glasgow. Scotland.,moltomacster,0,1,2021-03-30 20:08:22
763,"@gorillaz yk what’s a serious matter? the fact that y’all are openly destroying the environment just for some cash! almost like gorillaz succumbed to capitalism and lost their morals in the process,,, anyways stream!! 😁😁😁 https://t.co/nJQkqMZBbE","kong studios, essex, england",nessieisanidiot,0,1,2021-03-30 20:08:16
764,"In the new curriculum, grade 6 science talks about climate. NOWHERE does it mention the adverse effects oil has on the environment at all. This is starting to sound more like propaganda...",,l33lvnd,0,3,2021-03-30 20:08:15
765,And in her more natural environment! #dogswhoSUP https://t.co/8vJ9P66JZp,,HelenJBlamey,0,2,2021-03-30 20:08:11
766,"6) The social network of the work environment, LinkedIn, has created an application called #Skillls Path in which #job seekers can find their qualities and attributes.",Worldwide,ErdemErkul,0,0,2021-03-30 20:08:10
767,@MAbuhadida @MbKS15 You can’t there is a large space to be protected and rough environment for air defense vehicles and because this is suicide drone it can hit any targets near the border like the SANG outpost the guy filming from,"Melbourne, Victoria",fai9laziz,0,0,2021-03-30 20:08:06
768,"Some great tips to make sure that everyone has a voice, especially in a #remotework environment: https://t.co/SgX4LlUftJ by @westfallonline","Irvine, CA",mavenlink,1,2,2021-03-30 20:07:59
769,"@SoTheyShay I would say your “every day” woman. Before I was working in addictions treatment and it was extremely difficult, especially because leadership purposely created a hostile work environment.",Baltimore,muff0613,0,0,2021-03-30 20:07:55
770,"God wants you to create an environment for His will to be expressed. 
#MercyConference2021 @RealJerryEze",7 Surulere Industrial Rd Ikeja,HODChurchNG,1,2,2021-03-30 20:07:55
771,"""Fast-paced environment may not be suitable for everyone"" on a 5-star Glassdoor review... https://t.co/2LHSSHhJWg","Los Angeles, CA",calebandrew,0,2,2021-03-30 20:07:55
772,The stock market could double by 2030 because COVID has ‘utterly changed’ the policy environment: analyst - MarketWatch https://t.co/7U2hJclTwD,South Florida,ProTraderAlan,1,1,2021-03-30 20:07:54
773,"@JoeMerrick If I had to guess, they're testing out the reduced switching timer in a limited environment before rolling it out as a main mechanic.",,fawkes4387,0,0,2021-03-30 20:07:50
774,"@AngelaDavisMPR great show today! You mentioned comfort, the environment and social justice. We would love to be your next guest to discuss this from thrift POV. Our stylist and a local thrift maven are ready!",Twin Cities,ArcValueVillage,0,1,2021-03-30 20:07:42
775,"Disease outbreaks more likely in deforestation areas, study finds https://t.co/o8n7lplqwC",,MiltonSoto55,0,0,2021-03-30 20:07:41
776,"Labor looks set to avoid internal controversy over its energy policy when its national policy platform is debated on Wednesday as it lays the ground for a battle with the federal government over environmental laws.

#environment #auspol #climatechange  https://t.co/1ObFNcbxGr","Melbourne, Australia",theage,1,4,2021-03-30 20:07:38
777,"@WorldAndScience That's a bit of a mis-characterization. Sure, no batteries, but they do require from the surrounding environment. As I read your title first, I assume it was bunk (perpetual motion, law of Thermodynamics), but it's just a misleading summary.","Oklahoma City, OK",schuchert,0,0,2021-03-30 20:07:38
778,"NFTs are suddenly everywhere, but they have some big problems: For several weeks, it's been near impossible to exist on the internet without at least hearing a mention of NFTs. Short for non-fungible tokens, they are pieces of digital content linked to t… https://t.co/P8ZGkqpg0j",,Macrotestbot,0,0,2021-03-30 20:07:36
779,"@KFILE Germans can be funny about their people, especially rescues. And it’s probably hard on the dog to be in such a chaotic environment like the WH... a lot of dogs would not react well there, but it doesn’t mean they’re aggressive. 😕","Washington, DC",KitKatLynne,0,19,2021-03-30 20:07:31
780,Changed my mind. I need a change of environment and African food 😂,"Southampton, England",wuraolaszn,0,0,2021-03-30 20:07:16
781,"@meelar @PlanningAutumn In the context of a city w/ plenty of pre-WW 2 architecture standing, I could agree.

In the context of Downtown Atlanta where we have very little left (and thus the 'ask' of preservation is small in its footprint), I'll disagree. 

Context is King w/ the built environment.",Atlanta,atlurbanist,0,2,2021-03-30 20:07:09
782,Healthy minds breed healthy environment,,Freddie_blacks,0,1,2021-03-30 20:07:07
783,Big believer of kids need to go back to playing on the streets. Building confidence and composure by just playing/ making mistakes and also it’s fun. One of the most talented player in the Irish league Jordan Stuart has come from that environment.,Amongst La Familia!!,ormo123,0,1,2021-03-30 20:07:03
784,"@GuidanceOfOrder Violetgrass is a plant that enjoys a moist environment and is best picked after it rains. If you should choose to pick any, be sure to store them appropriately.",minor cbyf ☭ ic: purin2u_,CHiLDE_BF,0,0,2021-03-30 20:07:03
785,@OverexcitedDrgn @kittenprinxe They could never imagine being in a supportive environment.,beware the 💿🐴,beesandstars,0,2,2021-03-30 20:07:03
786,Welcome To Ladun Liadi's Blog: Governor Wike SACKS Commissioner for Environment https://t.co/CcVDaidv8V https://t.co/ZO7e69qV2s,Everywhere,Ladunliadi,0,0,2021-03-30 20:06:56
787,just dust off my jeans and go back to being just as pre pandemic. Literally the team I’m on rn is the team I previously left precovid bc I didn’t feel safe to collaborate without feeling like I’d be talked down to. How am I supposed to be productive in a hostile work environment?,,SleepySylviii,0,3,2021-03-30 20:06:55
788,"#Gold is 2% to the downside away from being in a technical bear market, when it’s supposed to be the best macro environment for #gold in a generation. #Bitcoin just 3% off its all-time high. You do the math.","Tennessee, USA",TennHedge,0,4,2021-03-30 20:06:54
789,@henshaw_jenn @Bateson_AB Both parties have learned how much Albertans care for a healthy environment. Rookie mistakes on both sides.,,MarksSimsAB,0,0,2021-03-30 20:06:53
790,“Enabling Environment Imperative For Dialogue”: Imran Khan Writes To PM Modi https://t.co/qUbjmC6dkp,meerut,isn7news,0,1,2021-03-30 20:06:52
791,Coffee pulp helps Costa Rican forests grow back from deforestation https://t.co/4NI99TvKRG #Traveler #Travel #TravelGuide #TravelDeals #TravelNews #TravelTips #Trip #Trips #Tourism #Excursions #Globetrotter #Adventure,,The__Traveler,0,0,2021-03-30 20:06:49
792,"@GreenKnight200 while creating an hostile environment for socialists one was also created for Jews, the phrase For the Many Not The Jew summarises this dichotomy, it made them become something they professed to be fighting against #antisemites @LBC",Wales,Dailewis,0,0,2021-03-30 20:06:39
793,All litter winds me up but PPE especially... https://t.co/TW0RIN40M8,"Sudbury, Suffolk",rossebentley,0,0,2021-03-30 20:06:37
794,"NFTs are suddenly everywhere, but they have some big problems #CryptoNews https://t.co/fUP3W0UYGn","London, England",CoinzProfit,0,0,2021-03-30 20:06:37
795,Machine translates brainwaves into sentences https://t.co/23z4I7rOXD,,Nevejan80955462,0,0,2021-03-30 20:06:16
796,"Holy fucking ass, so it's our fault now that we thrive in your environment while some didn't? ""your kind"" good lord. 😂 https://t.co/XYxjvCUQqt",🗽,logicalfilipino,0,0,2021-03-30 20:06:11
797,"Governor Wike sacks Commissioner for Environment
https://t.co/cuCQc7VwLV",Abuja,NewspotN,0,0,2021-03-30 20:06:09
798,@xIndigoRaex As you should! Gotta make yourself comfortable in a new environment!,NJ,ArielleMonai,0,1,2021-03-30 20:06:07
799,@KFILE This dog is STRESSED! The White House isn’t a good environment for him 😕,,FaintlyMcAbre,0,7,2021-03-30 20:06:05
800,By far the worst part of any kind of ML work is getting the python / CUDA / whatever else environment right,"Orange County, California",mfentonHEP,0,1,2021-03-30 20:06:05
801,A biochemical engineer at Missouri S&amp;T is developing a vehicle fuel tank that will harness methane gas from decomposing plants and animal waste. https://t.co/gQxRbZbZIQ https://t.co/EmhBFVvfCj,"St. Louis, Missouri",stlpublicradio,1,1,2021-03-30 20:06:04
802,"@callmemrsalbarn @gorillaz nft is a form of cryptocurrency and gorillaz is basically making them now with superplastic. the issue is that nfts are horrible for the environment and well,,, the hypocrisy is real considering their discography. there’s articles on nfts and gorillaz nfts a google search away.","kong studios, essex, england",nessieisanidiot,0,0,2021-03-30 20:05:58
803,@RecycleMB Programs like these make people believe saving the environment is in the hands of the public. It isn’t. Corporations need to take responsibility for excessive plastic production. That 25k should be used to lobby for plastic production reform.,"Winnipeg, MB",real_diaphanie,0,0,2021-03-30 20:05:57
804,"Made me think of you Sophie, I assume you gave it a miss or did you  🤪🤣

Anyway, hope all is OK and that you are enjoying being back in a proper education environment and have sorted your Uni?

https://t.co/lmqfvfiRHQ

@sophxsteele","West Sussex, South of England",Heinro,0,0,2021-03-30 20:05:49
