,Content,Location,Username,Retweet-Count,Favorites,Created at
396,"Two Bee Experts, Two Opinions, One Dying Bee Population! https://t.co/KXpTCMxhU9 neonicotinoids #bees #agriculture",New York,TheOrganicView,0,0,2021-03-30 20:24:21
397,Rebumping this thread from @susannebrooks in light of the new @NRDC report calling for the same at least 50% cut in emissions by 2030 NDC commitment https://t.co/sH1fE8VzKc. And check out this @guardian article on the broader support for this target: https://t.co/6tfAshHAt1 https://t.co/SBaoTZpAZ9,DC,SteveCapanna,0,0,2021-03-30 20:24:14
398,@Milliganreports You could also do a story on Blueberries &amp; how NSW EPA turns it back on investigating dearth of aquatic species in creeks due to run off of fungicides and loss of valuable koala habitat Ban the bloody blueberries bad so bad for our environment,Korora,krisgracehely,0,2,2021-03-30 20:24:07
399,it was just way easier to kickstart a positive feedback loop wrt motivation that led to wanting to do it for its own sake in that environment,icon @kanzakiyufei,coultenet,0,1,2021-03-30 20:24:04
400,"Given the current low interest rate environment, homeowners seeking to borrow against their equity have many great options. We encourage you to talk with a variety of lenders to get the best deal. Learn more at https://t.co/Lkp9toDJ9W. #Dweller #ADU #Financing https://t.co/LuPu96sw5J","Portland, OR USA",dwellerhomes,0,0,2021-03-30 20:24:02
401,"Despite synthetic dyes permeating the fashion world for over 160 years, several brands are now going back to basics and making the clean switch to natural #dyes to alleviate the dangers #syntheticdyes can present to both the #environment and the people.",,RedCarpetGreenD,0,0,2021-03-30 20:24:00
402,"The funds are there for a Wakehurst Parkway flooding fix, but @beachescouncil
wants to know if you think the risk to the environment is worth it. #northernbeaches https://t.co/unqMDBEzUF",,nadine_morton,0,0,2021-03-30 20:24:00
403,"As early-education schools play a huge impact on a child's emotional development a calming, welcoming, and dynamic environment must be manifested through the interior design of the building. https://t.co/kNKlFMtX2E","Chicago, IL, USA",akarchitects,0,0,2021-03-30 20:23:58
404,"@brembs @talyarkoni I have argued before that science has become a gamable environment, thus attracting cheaters. The incentives attract and filter for bad people, but they don't make bad people. Therefore I agree, incentives can never be an excuse for gaming the system, only for not playing 1/2",,PhilippMarkolin,0,0,2021-03-30 20:23:57
405,"This type of injustice lights a fire in my soul - the desire for justice, to right the wrong. We have societal injustices that can be fixed if we at least try. Switching to clean energy is so important, not only for the environment, but also for everyone’s health and well being.",,HockeySniping,0,0,2021-03-30 20:23:57
406,Here's another version of our story published in Life in the Trails Magazine. We are so grateful to be recognized by these outlets for creating an environment where employees can grow! Did/Do you have a workplace that puts emphasis on employees? Tell us in the comments below. https://t.co/Ieoir5FJDV,"Lutz, FL ",10Charlene10,0,0,2021-03-30 20:23:55
407,"@DRE777_ I usually make a tea to avoid nausea, but it can be more intense for a shorter period of time. Safe environment and have people you feel safe with. CBD is a trip killer if needed.",dumbass,decayinghost,1,1,2021-03-30 20:23:51
408,This is how we treat our animal relatives. World's rarest great ape is on the brink of extinction | TheHill https://t.co/uFwpMKyEw0,We Are Everywhere,MarkEtWords,0,0,2021-03-30 20:23:51
409,Maintaining professional standards in fast paced environment with rapidly shifting priorities and undefined processes. https://t.co/JPgzbGYZds,,timtempleton,0,0,2021-03-30 20:23:47
410,@CNN Aww...Major is evidently not happy in that environment.,"Florida, USA",JLangWood,0,2,2021-03-30 20:23:47
411,"When the economists are actually/finally asking for action, don't you think it's more than high time? https://t.co/Exw9B41jM6 @potus @EPA @Gina_McCarthy @JohnKerry @DemWarRoom @HouseDemocrats @senategop @housegop @wsj @davos @TheEconomist @ft @nature_org @UNFCCC @antonioguterres","Mother Earth, here and now.",jnaneswari1,0,0,2021-03-30 20:23:41
412,"@RicoSuaveJD @KFILE i think it's more about environment, chaos and needing a consistent handler who knows how to set him up for success and not allow situations to happen where he may revert to instinct.",,MarthaM00086745,0,1,2021-03-30 20:23:33
413,"If we’re actually carrying these body system and mentality of ours to hell, there’s probability we’d adapt to that environment and continue another life there..",Juice wrld 🦅❤️,Just_Silva__,47,80,2021-03-30 20:23:27
414,"@takeyopantzoff @moghilemear13 When you illegally enter a territory and destroy their environment and steal their resources, yeah that's imperialism lol","Guadalajara, Jalisco",pajarocentral,0,0,2021-03-30 20:23:23
415,@HelenJBlamey Me in my natural environment. https://t.co/Dv7RqeTcWh,,martincolclough,0,0,2021-03-30 20:23:22
416,Oh you want me to thrive in a fast-paced work environment? Sounds toxic,"Austin, TX",ashleyd_j,0,1,2021-03-30 20:23:22
417,"Thanks to Jeanette @JetBlackSquares for the fab Smart Phone Photography workshop live event from the Park - lots of great feedback. Keep an eye on  https://t.co/e0gVimeLBx for more events like this along the Thames. @LDN_environment @TNLComFund @HeritageFundUK
@Thames21 https://t.co/9xkwFcZe6u","Harrow, London",headstonepark,0,0,2021-03-30 20:23:22
418,"MissionBlue: We are deeply thankful to our partner @ROLEX for embracing Hope Spots as a pillar of their Perpetual Planet initiative. Protecting the ocean - Earth's blue heart - needs all hands on deck, and we're immensely grateful for ROLEX's support. #P… https://t.co/yK6vvjLsPr","TX, CA, ME, MD, NH & Ontario ",FinsandFluke,0,0,2021-03-30 20:23:18
419,"I literally felt obligated to apologize to white male media members for making ""blanket accusations""- it's messed up that I felt like I had done wrong for speaking truth. That was a diff environment tho. To see this kind of violence happening in NYC, where I live, is devastating","New York, NY",StephanieWei,0,5,2021-03-30 20:23:16
420,@Thewyrewagtail @Steveredwolf @LadySG This one prefers a more woody environment,Worcester,FergusHenderso1,0,0,2021-03-30 20:23:16
421,"@RichardCodey @JohnFMcKeon @northjersey @tomkean @JonBramnick @KipBateman @NJSpotlightNews @NJ_League @nytopinion @NJTreasury @mikedohertynj @PatrickDiegnan @senatortesta @AndrewZwicker @EighthNj @AsburyParkPress @NJGov @njfbla @RutgersResearch @GlenRidgeNJ @MaplewoodPatch @MontclairTimes @SOPatch @VeronaTownship @RutgersBSchool @blousteinschool @politiconj @NewJerseyOAG Welcome Hannah Thonet.

Policy Advisor for Energy and the Environment

Start date: 4/12/2021

@hthonet comes to the Governor’s Office from the Board of Public Utilities, where she serves as Senior Policy Advisor. BA at Syracuse University. MA at Columbia.

https://t.co/fKpdRuED2B",United States,justinalpertesq,0,0,2021-03-30 20:23:13
422,"This fact is scary, but true. We here at the @GonzagaU Climate Center are here to educate, collaborate, and learn in effort to tackle the #ClimateCrisis. Join us in this journey by registering for launch on #EarthDay Click here to register!https://t.co/IPW48Sof66 #gozags https://t.co/WogYNgQZ3u","Spokane, WA",GonzagaClimate,0,0,2021-03-30 20:23:11
423,Automakers and parts suppliers are prepared to spend $250 billion on boosting the use of electric vehicles in the U.S. https://t.co/pXQOl6cHtA,,environment,2,2,2021-03-30 20:23:08
424,"@ctbeiser That sort of scenario is basically no different from a wild crossover, in an uncontrolled environment. Saying the virus came from a lab before they catalogued it is like saying researchers got infected out in the field, that’s just a wild crossover event no lab could stop.",San Jose,gonglei89,0,0,2021-03-30 20:22:58
425,"@bringdoomsday basically it's like images being converted to currency ? the problem is that making them takes up a LOAD of energy, making it really bad for the environment",he/it + neos ☆ 16 ☆ cbyf,kobrastarships,0,0,2021-03-30 20:22:53
426,@CNN This dog is to stressed out to be at the White House!  This is a shelter / rescue dog.  He has  needs that go beyond a normal dog.  It is admirable that they went the rescue avenue but this dog is not suited for this type of environment.,,Trim_Level,0,10,2021-03-30 20:22:51
427,"@rockafunkilus @JLCauvin I haven't seen the video (fact)
In today's viral video environment where everyone knows someone is recording can we believe this to be true, who were the bystanders? Were they setting up a defense and waited to not ruin the viral-ness of the clip knowing it will drive social meta",,Lily_Scott_says,0,0,2021-03-30 20:22:40
428,"As a young determined youth whose dream is to be nothing but GREAT, its difficult; Waking up every morning realizing that you found yourself in a country &amp; an environment where ""WHAT YOU KNOW"" doesn’t matter rather ""WHO YOU KNOW"".

#SSOT
#SouthSudan",East Africa,AwehMajurAleer,1,2,2021-03-30 20:22:38
429,"@KateBennett_DC He’s a puppy, in a new environment... a shepherd, it’s his job to protect his owner.  Give him some time, he is a beautiful dog.",,Audra88853730,0,0,2021-03-30 20:22:24
430,"Has anything changed? It's been almost a year since commercial beekeeper, Jim Doan lost his bees to #neonicotinoid exposure. https://t.co/k1bOStxblT neonicotinoids",New York,TheOrganicView,0,0,2021-03-30 20:22:21
431,@bringdoomsday i don't know what it is but it's bad for the environment i think,xvi ⚢,V4MPRZ,0,0,2021-03-30 20:22:21
432,@KFILE Some dogs can not adapt to the stress of activities &amp; people. Taking a pet from a quiet environment to a busy one doesn't always work-he's frightened &amp; feels threatened or he wouldn't nip.,,HollyJa52637364,0,0,2021-03-30 20:22:19
433,"I could be reading the new KanoKari chapter but, instead, I'm here sitting like a dumbass waiting for a Pythra to come into my arena so I can practice the matchup against a mashy character in an environment where I can't punish anything. My life was a fucking mistake",,JorgeTheLad,0,0,2021-03-30 20:22:18
434,@CentreGround6 @spikedonline It is very conservative to care about the environment.,"London, England",ccityplanner12,0,0,2021-03-30 20:22:16
435,one time in civics we had an abortion discourse and i was arguing w someone and was like “what if they get raped they shouldn’t have to kept the baby and what if they’re in an environment where they can’t keep the baby” and she went “well that’s their fault for getting pregnant” https://t.co/pHxuW3TU60,,pgpetal,0,2,2021-03-30 20:22:11
436,"More landscape doodlin'

#art #drawing #illustration #sketch #ArtistOnTwitter #conceptart #visdev #visualdevelopment #landscape #environment #procreate #ArtOfVibrancy #desert #canyon #clouds #environmentdesign https://t.co/PAxxPuKbmV","Phoenix, AZ",jr_illustration,0,1,2021-03-30 20:22:06
437,"@PoseidonsLight Yeah, I agree, especially for those who target scaling fast... people with great skills are required. On the other hand, a person with potential is a great asset in 'building' the 'work-environment' because of high motivation. Pretty great for long-term purposes.",,domdimsu,0,0,2021-03-30 20:22:04
438,"*Heaven &amp; Hell*

In summary, we have euphoric, oceanic, blissful feelings, sometimes feelings of being poisoned or being in a toxic or polluted environment; followed by crushing, no-exit, depression, claustrophobia, compression, strangulation,

https://t.co/Wy8SV6VrSP #FBR #Earth","Eugene, OR",sillymickel,0,0,2021-03-30 20:22:00
439,@CNN The dog isnt used to the environment dongs bite when they are insecure.... the dog should be given more time,,MarioOdiachi,0,0,2021-03-30 20:21:59
440,"These Amazon workers say they can be sacked for using the toilet. Now they're threatening t…
An ethical corporation cares for all stakeholders: shareholders, customers, environment &amp; WORKERS! Today the ONLY focus is on shareholder value. #auspol https://t.co/6eT6yT03Ra","Sydney, New South Wales",Greg_CHF,0,0,2021-03-30 20:21:55
441,@YAbbanx So Ghana ebi say dem curse we plus trees what.. see the empty environment with fewer to no trees!! Smh,Unknown ,Roguemanrod,0,0,2021-03-30 20:21:52
442,"“Mostra” is the Italian word for “performance.” We’re dedicated to the craft from start-finish. Our performance doesn’t start with our drinks, it starts when you walk through our doors.

Our goal is to give an experience that in a family environment w/ a delicious cup of coffee. https://t.co/AhuRKusRwF","San Diego, CA",MostraCoffee,0,0,2021-03-30 20:21:47
443,"Surely he just feels confused with everything going on around him. In the fast paced environment at the White House it's understandable that he'd be overwhelmed, unstable, and agitated. He probably shouldn't even be there.

The dog should leave also. https://t.co/saimrNMd1f","Wisconsin, USA",2_the_Republic,0,0,2021-03-30 20:21:45
444,"@DodoDuncan @patrickharvie @lornagreens Completly disagree. Supporting independence is very important so that Scotland can get on its own two feet and change for the planets benefit. As part of a union that doesn't care about the environment, there is no chance as everything has to go through the Cons down south.",Scotland,Krisfozz1,0,0,2021-03-30 20:21:44
445,"@VegasVisions 😭😭😭😭Liberals wanting decent healthcare , education, a clean &amp; sustainable environment &amp; a system that treats all people with dignity and respect is making the GQP turn against democracy?! 🤣🤣🤣Another RW lie. As we now see, they were secretly fascist all along.","Portland, OR",JamesSa75888275,3,5,2021-03-30 20:21:43
446,I don’t know whats going on but if you are an adult in a fandom you have the responsibility of creating a safe environment for minors idc if you don’t interact with them cause it makes you uncomfortable if they somehow come across you there shouldnt be any hostility on your part,she/her ||25||,cosmicjunhee,0,0,2021-03-30 20:21:41
447,@RadioTABAus 2/2 get to become All Blacks thus devaluing the AB jersey . That huge offer in today’s COVID uncertain environment would be absolutely crazy to decline,"Brisbane, Queensland",Cuzziebro8711,0,0,2021-03-30 20:21:38
448,"Cuomo’s solution to questions about his having sexually harassed 10 women, covering up Nursing Home deaths, and fostering a entirely toxic work environment is to ... slowly morph into Greg Abbott https://t.co/IWJYfryW2C","Rossmoor, CA",davidagordon9,1,9,2021-03-30 20:21:35
449,Am I going to be able to sing Dolly Parton at my desk when I return to the office? Im used to a certain working environment now.,"Salt Lake City, UT",EvilyRad,0,3,2021-03-30 20:21:31
450,@itvnews That Britain’s Tiger King program demonstrates how wrong the law is in the U.K. regarding keeping wild animals. @BorisJohnson You properly need to look at this if you remotely care about the environment.,Essex,spokeninjest,1,0,2021-03-30 20:21:31
451,@the_gunnshow I hear ya and I don’t even have kids. I can’t imagine the prospects of raising children in such a hostile environment. Good luck...,Edmonton,IAMRockwell,0,1,2021-03-30 20:21:29
452,you and every other company participating in this should be ashamed. not only do you underpay your staff but now you are destroying the environment with this fucking scheme. https://t.co/C1tSuyaN7s,,HauntedFairy13,1,2,2021-03-30 20:21:26
453,"@UEALeaders @bespokespeeches @EUSpeechwriters @ProfAFinlayson @GretaThunberg @SevernSuzuki @LeoDiCaprio @algore Get in touch with my friend, speechwriter and passionate environment champion Rune Kier Nielsen @RuneKier",London,Worldspeechday,0,0,2021-03-30 20:21:26
454,'Delay is as dangerous as denial': scientists urge Australia to reach net zero emissions faster https://t.co/P2HfrcWv2y,Sydney,DaveBathur,0,0,2021-03-30 20:21:24
455,"@yuilly12 Split, one guy went on a nationalist rant and was cut off, and some people fed up with independence chat. Good to see a couple of young girls concerned about the environment and what we’re doing about that going forward - that was probably the only time the green lady spoke well",United Kingdom,Dave12346894,0,1,2021-03-30 20:21:17
456,"And just like that, democrats no longer care about the environment........ https://t.co/upZZPLYqRB",United States of China,ScottZdot,0,0,2021-03-30 20:21:17
457,"@sassybibrarian @KateBennett_DC Yes, he might be much happier in a more calm environment. Poor pup.",,reading13j,0,2,2021-03-30 20:21:16
458,Imran seeks ‘enabling environment’ for dialogue https://t.co/4UMoxlpQig,India,vision_kashmir,0,0,2021-03-30 20:21:15
459,@80_mcswan More about who lost. @Douglas4Moray  and @willie_rennie both lost. Anis Sarwar pick up later on in the debate. I do like @lornagreens arguments although the environment question was a softball haha.,In my own head,GizmoABDN,0,0,2021-03-30 20:21:14
460,Leak at old phosphate plant could cause discharges into Tampa Bay https://t.co/jfsnXULsqH,"Tampa Bay, Florida",ChrismPrism,0,0,2021-03-30 20:21:09
461,'Delay is as dangerous as denial': scientists urge Australia to reach net zero emissions faster https://t.co/wgzciFIE9d,,guardiannews,10,20,2021-03-30 20:21:08
462,"@J_SchaefferWOI There are a number of things wrong, joystick coaching at younger ages.

The overall environment we have created (on a macro level) has been not good enough. For every coach or club that does things well, there are 3-4 that don’t.","Omaha, NE",_JoeCleary,0,1,2021-03-30 20:21:08
463,@ThomasHTaylor Aww I hope you have some antiquities around you. I imagine you in a quirky writing environment 😂,"Maidstone, South East",MrsKEcowarrior,0,0,2021-03-30 20:21:03
464,Biden should cut red tape to unleash the green economy https://t.co/E4yDpN0t70,"Washington, DC",TheHillOpinion,3,5,2021-03-30 20:21:00
465,"Company: This product is awesome. Consumers love it and it is making us a lot of money. 
The environment, affected by the pollution caused from production: https://t.co/bF8290kJp8",,fastslowdisco1,0,0,2021-03-30 20:20:56
466,@business no pressure..control environment ppl wear masks. no off site alcohol..,"South East, England",rationallity,0,0,2021-03-30 20:20:55
467,"@CameronMcNeish @PhantomPower14 Maybe it was just my hearing but, he did say he would refuse to work with the SNP (if they win the election) on environment issues. An issue that is one of the most important for many years to come. He's also more interested in the constitution more than anybody else.",,Alexand04632345,0,2,2021-03-30 20:20:50
468,"@CimerFlight They need to either hire a dedicated person/team to look out for him and train him, or send him to Delaware and let the grandkids keep him. Champ is older and calm, but Major is too young for that environment without lots of guidance.","North Cack baby, not a boss ",ResearchBuzz,0,0,2021-03-30 20:20:48
469,"In the meanwhile Gates is buying up all the farmland... 

#billgates
#environment
#USA
#EnvironmentalJustice
#environmental

https://t.co/p73TKxDpim",EU,cath_ge,0,0,2021-03-30 20:20:46
470,"@PatrickMKehoe1 @daily_barbarian So the one is a feeling or sense, and the other is a system or cultural environment?",,sirach_23_28,0,0,2021-03-30 20:20:44
471,"@goingglocal IMO, outside of a hunting environment, any person carrying a weapon (legitimately or not) sends the signal that they are afraid.
That the hate Christ and that they do not trust in the Lord.","Ankeny, IA",Iamright20,0,0,2021-03-30 20:20:38
472,"@elonmusk Final offer Elon,
If you're serious about long space flights?
Iv designed a suit that will help to stop muscle waste in a zero gravity environment!
It will save many hours of recovery time and lots of valuable weight..
Krgds.
Dale","kent, uk",diddidale10,0,0,2021-03-30 20:20:37
473,@cathmckenna @TheSpec Resistance to Catherine letting go of the environment file is futile. She was embarrassingly relieved of her duties long ago but won't vacate the chair. If she repeats it enough Skippy will forget that he fired her. Lol!,,SafeSnoflake,0,0,2021-03-30 20:20:34
474,"Our programs &amp; services challenge and enable students to become compassionate and responsible citizens and leaders of the campus, local, and global communities by fostering an inclusive, culturally diverse living and learning campus environment. https://t.co/TOw7hh4ij6 #GiveUNC https://t.co/nA4KILa64J",,UNC_SA,1,2,2021-03-30 20:20:33
475,Department for Environment Food and Rural Affairs: Joanna Lumley: ‘Stop harming Whales and Dolphins with leftover WWII Bombs!’ - Sign the Petition! https://t.co/QAyysEGWWb via @UKChange,"Morley, West Yorkshire ",Richard30480428,0,0,2021-03-30 20:20:31
476,@Its_Jacob0 Invest locally then and fulfill the promises made. Musk is following the old playbook of exploiting local communities and destroying livelihoods and the environment in the process.,,hayamyma1,0,0,2021-03-30 20:20:29
477,Claim: The oil company in North Dakota were affecting the people there and its environment #lastweek1101,,KhariProctor,0,0,2021-03-30 20:20:29
478,The stock market could double by 2030 because COVID has ‘utterly changed’ the policy environment: analyst - MarketWatch https://t.co/mF6JVTcOSc,"London, UK",NahidAlaei,0,0,2021-03-30 20:20:19
479,just looked at rate my professor for the professor i scheduled for my spanish courses bc she was the only one available and she has a 2.6/5 rating and one of the reviews from a few days ago says “please avoid she creates a toxic classroom environment” https://t.co/YN8W3luUyb,johnny ♡ reiner ♡ roy ♡,suhnsationaI,0,1,2021-03-30 20:20:18
480,"WHO ARE WE? 
This NEW board of students is here to enhance your experience at NAU by creating a welcoming environment, providing fun activities and a chance for you to connect with fellow Lumberjacks! Follow @nau.lab for awesome content and to receive up… https://t.co/ZpwDtV7Ohg https://t.co/ygeEwo5ssu","NAU, Flagstaff, AZ",SUNEventsNAU,0,0,2021-03-30 20:20:15
481,"@erikaispanlol Reuse, repurpose, recycle.

I'm thinking about the environment","Newcastle Upon Tyne, England",FENNERGY,0,2,2021-03-30 20:20:14
482,"WHO ARE WE? 
This NEW board of students is here to enhance your experience at NAU by creating a welcoming environment, providing fun activities and a chance for you to connect with fellow Lumberjacks! Follow @nau.lab for awesome content and to receive up… https://t.co/RXNvzEA3gF https://t.co/jmq3RESuuP","NAU, Flagstaff, AZ",SUNEventsNAU,0,0,2021-03-30 20:20:13
483,"@BSC_Newspaper a new blockchain with a full-fledged environment for developing high-performance decentralized applications. It was built for cross-chain compatibility with Binance Chain to ensure that users get the best of both worlds

My address 0xbb43dc6877b34437d028004aa8d45b49adf2e285",,mashiroooooonn,0,0,2021-03-30 20:20:12
484,"WHO ARE WE? 
This NEW board of students is here to enhance your experience at NAU by creating a welcoming environment, providing fun activities and a chance for you to connect with fellow Lumberjacks! Follow @nau.lab for awesome content and to receive up… https://t.co/XVyZEBESOt https://t.co/CT1kJHWHQV","NAU, Flagstaff, AZ",SUNEventsNAU,0,0,2021-03-30 20:20:11
485,"We're excited to see so many strong advocates who have been doing environmental justice work for years on the @WhiteHouse list of members for the #EnvironmentalJustice Advisory Council. Congrats @CathFlowers, @DrBobBullard &amp; @TomCormons of @AppVoices! https://t.co/H38TFTgTGL","Charlottesville, VA",selc_org,0,3,2021-03-30 20:20:11
486,"In all seriousness, the dog is probably anxious and territorial of the new environment. In slightly less seriousness, get rid of that person too. https://t.co/X86N8wRROs","Colorado, USA",EpistolaryLover,0,0,2021-03-30 20:20:10
487,"Only in America would a water company be allowed to turn your water off during a pandemic. This is an outrage and shameful @POTUS
https://t.co/XTn8l0NmpF","California, USA",LulaPuch,2,1,2021-03-30 20:20:09
488,"@lucyann28211055 @BBCWorld David Attenborough would of been better as he was heading the cause long before her &amp; educating young &amp; old about the planet, the environment &amp; animals &amp; hes a UK citizen.",Co. L/Derry,CarolineMcElhi2,0,0,2021-03-30 20:20:06
489,"Findings from Smart City Solutions for a #RiskierWorld are now publicly available. Discover how 167 cities around the world are managing #SDGs, #technology, and reimagining the urban environment. https://t.co/6cu3ybk77N https://t.co/EFpMWJIUv8",Philadelphia PA,econsultsolutns,1,1,2021-03-30 20:20:05
490,"Findings from Smart City Solutions for a #RiskierWorld are now publicly available. Discover how 167 cities around the world are managing #SDGs, #technology, and reimagining the urban environment. https://t.co/Uo15I5TTqa https://t.co/jI7fKF7NvQ","Philadelphia, PA",ESIThoughtLab,0,0,2021-03-30 20:20:05
491,Here’s what I don’t understand about the Major thing: he’s the President’s dog. Why doesn’t he have a dedicated trainer / handler with him at the White House which anyone would be able to identify as an incredibly stressful environment for a dog?,"Queens, NY",hamsinthewest,0,0,2021-03-30 20:20:04
492,"No you're not reading this wrong: the southern purple spotted gudgeon are back after being extinct for 20 years!! 

https://t.co/kAZjvNTA0g

#environment #positive #news #fish #purplespotted #gudgeon #canada #BC #nature https://t.co/XXCPz9IEQc","Vancouver, British Columbia",HappyEcoNews,2,2,2021-03-30 20:20:02
